,Date,Title,Content,Category,Image_link,Article_link
286,2020/10/05,Man stabbed to death near Nedumbassery,"Suspected case of inter-gang rivalry

A man was allegedly stabbed to death at Kayyalapadi near Nedumbassery on Sunday morning, in what is suspected to be a case of inter-gang rivalry.

The victim, Jissmon, 36, of Thuravoor near Angamaly had been facing charges of drug peddling. The police suspect that he was murdered by members of a rival gang over narcotic trade. A hunt is on to trace history-sheeters associated with the trade. The Nedumbassery police have registered a case under Section 302 (murder) of the IPC.

Protocol violations

The Ernakulam Rural police have taken action against 39 shop owners for not adhering to the COVID-19 protocol. Special teams have been deployed in the district to keep tabs on protocol violators. District Police Chief (Ernakulam Rural) K. Karthick said Section 144 would be strictly enforced. In Kochi city, a fine of ₹32,200 was collected in 161 cases by flying squads deputed by the District Collector.

Child porn case

The Ernakulam North police on Sunday arrested a man on the charge of circulating indecent photographs of children in social media groups. Jinu Baby, 31, of Thodupuzha was arrested from his rented house on Azad Road, Kaloor, during raids conducted as part of the Police Cyberdome’s Operation P Hunt.

Arrested with ganja

Excise officials on Sunday arrested a youth from near the KSRTC bus stand at Angamaly on the charge of possessing 5.250 kg of ganja worth ₹1.20 lakh. Rajesh, 26, of Pullery in Thrissur used to procure the drug from Tamil Nadu.",,https://www.thehindu.com/static/theme/default/base/img/og-image.jpg,https://www.thehindu.com/news/cities/Kochi/man-stabbed-to-death-near-nedumbassery/article32768180.ece
287,2020/10/05,Short film ‘I am Enough’ deals with issue of self acceptance,"Psychologist turned filmmaker Sujatha Balakrishnan talks about ‘I Am Enough” which deals with comparison and the need for self validation

As children we were constantly being compared to siblings and peers; as adults we tend to measure ourselves against others around us. The ill-effects of constant comparison forms the premise of ‘I Am Enough’ a short film scripted by Sujatha Balakrishnan.

In her experience as a psychologist for over two decades, Sujatha Balakrishnan regularly comes across people dealing with issues of self-acceptance.

“I strongly believe our self evaluation is highly influenced by the validation of others. This in turns affects our self worth and self esteem,” says Sujatha Balakrishnan.

“This is especially true amongst adolescents who are in an idealistic crisis at that stage of their lives. They are constantly facing questions such as, ‘Who am I? What do people think of me?’”

A particularly intense case where a teenager developed strong feelings of dislike towards a person she was constantly being compared to, made Sujatha realise greater awareness was needed on the topic.

American social psychologist Leon Festinger, known for his Theory of Social Comparison, has been an influence on Sujatha’s professional life. “Leon Festinger believed that we engage in this comparison process as a way of establishing a benchmark by which we can make accurate evaluations of ourselves,” she says.

‘I Am Enough’ is the story of a promising young swimmer who is constantly being measured by the academic success of her best friend and the impact it has on their relationship as well as on the mental state of the protagonist herself. It also sheds light on how parents, teachers and peers unknowingly aggravate the mental trauma by not being more supportive.

The story and screenplay of ‘I Am Enough’ were written by Sujatha Balakrishnan and directed by Pooja Pandey Tripathi with Usha Rao handling the camera and editing. The short film took about two months to write and two weeks to film.

Theatre for Change which débuts in the film genre in association with Being Theatre will be presenting I Am Enough on YouTube on October 15.",,https://www.thehindu.com/entertainment/theatre/skp2jl/article32770399.ece/ALTERNATES/LANDSCAPE_615/AIMG8380-2,https://www.thehindu.com/entertainment/theatre/short-film-i-am-enough-deals-with-issue-of-self-acceptance/article32770294.ece
288,2020/10/05,West Bengal’s total COVID-19 tally crosses 2.70 lakh,"West Bengal on Sunday reported 3,357 new COVID-19 cases taking its total infections to 2,70,331. The State recorded 62 more deaths pushing its fatality toll to 5,194. The active cases in the State have increased to 27,439 and the discharge rate has gone up to 87.93%.

Of the 62 deaths in the last 24 hours, Kolkata recorded 17 deaths taking the toll in the district to 1,767. North 24 Parganas reported 19 deaths taking its toll to 1,170.

Kolkata recorded 765 cases taking its total tally to 59,1 97 while North 24 Parganas saw 741 cases as its total tally jumped to 54, 182.

Of all deaths in the State, 85% (4,417 patients) had co-morbidities.

Meanwhile, Chief Minister Mamata Banerjee on Saturday said that the COVID-19 infection in the State had reached the stage of community transmission.",,https://www.thehindu.com/static/theme/default/base/img/og-image.jpg,https://www.thehindu.com/news/cities/kolkata/west-bengals-total-covid-19-tally-crosses-270-lakh/article32768390.ece
289,2020/10/05,East West Metro services in Kolkata extended to Phoolbagan,"With this, the city gets new underground Metro station after a gap of 25 years

The services of the East West Metro were on Sunday extended from Salt Lake to Phoolbagan in the heart of Kolkata. Phoolbagan is the first underground Metro station along the 16.55-km East West Metro route that will connect Howrah Maidan on the other bank of the river Hooghly to Newtown in the north eastern fringes of Kolkata.

With the resumption of Metro services in Phoolbagan, Kolkata gets a new underground Metro Station after a gap of 25 years.

The East West Metro was commissioned in 2008, Railway Minister Piyush Goyal said during the virtual launch of the project, adding that very little work on the project was done before 2015, leading to “huge delay” and “cost escalation” of the project. “I am told that by the end of next year the entire project in the 16.55-km route will be completed,” Mr. Goyal said.

The first phase of the East West Metro station from Salt Lake’s Sector V to Salt Lake Stadium was opened on February 13, 2020. With the extension of services to Phoolbagan, the distance between Sector V and Phoolbagan can be travelled in 16 minutes which takes about an hour by road, said Manoj Joshi, general manager of Metro Railway. The services of East West Metro to Phoolbagan will be open for general passengers from October 5.

Two tunnels

What makes the East West Metro project unique is two tunnels running parallel to each other about 37 metre below the riverbed of Hooghly. The first underwater tunnels in the country which were completed in 2017 are considered an engineering marvel. Of the 16.55 km, about 10.88 km of the East West Metro will be underground.

Metro Railway officials say that once completed, the East West Metro will ferry about seven lakh to eight lakh passengers. Kolkata is the first city in the country to get Metro Railway as early in 1984 and the North South Metro Railway was ferrying about six lakh passengers on a weekday before the outbreak of the COVID-19 pandemic. The services of Kolkata Metro were resumed last month and more than 50,000 passengers are availing Metro rides daily. Metro services are considered the lifeline of transport infrastructure of Kolkata which has the lowest road area when compared to other metropolises.

Trinamool’s charge

Meanwhile, the event, like the inauguration of the first phase of the East West Metro, witnessed allegations by the State’s ruling Trinamool Congress that Chief Minister Mamata Banerjee was not accorded due respect by not being invited to the event. State’s Urban Development Minister Firhad Hakim said there would have been no Metro Railway in Kolkata without Ms. Banerjee.",,https://www.thehindu.com/static/theme/default/base/img/og-image.jpg,https://www.thehindu.com/news/cities/kolkata/east-west-metro-services-in-kolkata-extended-to-phoolbagan/article32768301.ece
290,2020/10/05,Decline in fresh COVID-19 cases in Kozhikode,"641 test positive for SARS-CoV-2; six deaths reported from MCH

Fresh COVID-19 cases declined to 641 in Kozhikode district on Monday after continuously surging above a daily load of over 900 cases in the past few days.

According to the District Medical Officer, 584 of these are locally acquired infections. They include 139 people from within Kozhikode Corporation. The source of infection of 36 people is not known. There are 19 health workers among the newly infected. The number of active cases reached 9,829 of whom 5,830 are under home isolation.

Six deaths were reported from the Government Medical College Hospital, Kozhikode, on Sunday and Monday. Three of them, two from Kozhikode and one from Kasaragod, died on Sunday, the others, two from Kozhikode and one from Malappuram, died on Monday.

Market to reopen

Meanwhile, the Kozhikode Corporation has decided to reopen the Palayam market in the city from Tuesday. Its closure had hit the movement of fruits and vegetables in a big way though the market at Thadampattuthazham was designated for the purpose.

It was closed on September 23 after 233 people associated with the place were tested positive for SARS-CoV-2. However, the authorities said restrictions would be imposed for entry. Of the eight entry points, four will be closed and the barricades would be under police control. The health wing would examine the body temperature of all those who enter the premises.

The corporation would have to provide ID cards to traders, porters, and other staff in the market who test negative for the virus and only such people should be allowed to work there. Stalls would be allowed to operate only after 11 a.m. and pushcart vendors too should reach the premises around the same time. Quick response teams would be stationed to enforce COVID protocol.",,https://www.thehindu.com/news/cities/kozhikode/smsubp/article32775340.ece/ALTERNATES/LANDSCAPE_615/06tvkzvellyilharbar,https://www.thehindu.com/news/cities/kozhikode/decline-in-fresh-covid-19-cases-in-kozhikode/article32775341.ece
291,2020/10/05,‘More govt. hospitals needed to treat COVID-19 patients’,"Call to set up sufficient number of dialysis units and ICUs

With the number of active COVID-19 cases inching towards the 10,000-mark in Kozhikode, demand is rife to earmark more government hospitals for treatment in the district. There has also been a suggestion to set up more intensive care units (ICU) and start dialysis for infected persons at the hospitals.

Right now, the Government Medical College Hospital (MCH) and the Government General Hospital alone are the designated facilities in the public sector for treating infected persons. Malabar Medical College Hospital, Ulliyeri; KMCT Medical College Hospital, Mukkom, and IQRAA International Hospital and Research Centre, Eranhipalam, are those chosen in the private sector where low-cost or free treatment is offered.

However, the number of new cases has been hovering around 1,000 in the past few days, and almost 3,000 people were found infected in the past three days alone.

A senior doctor at the MCH, who did not wish to be quoted, told The Hindu that more government hospitals would have to be designated for treating patients. Though the number of infected persons at the MCH and the General Hospital is only 325 and 280 respectively, those in need of critical care among them are less than 100. So, if at least some who are not in need of critical care can be provided treatment at other government hospitals, it will help the health apparatus to focus more on severely infected persons, he claimed.

“Also, another major area of concern among the infected population are people who have renal issues. Right now, only the MCH offers dialysis to them in the district. In view of the rise in the number of newly infected persons, more government hospitals should also have similar facilities,” he pointed out.

Another doctor at the hospital suggested that taluk hospitals and community health centres be opened up for COVID-19 treatment. They should also be equipped with ICUs. “A person with another health issue is tested positive for the virus and admitted to the MCH. Within a couple of days, the patient’s condition may become better. Such people could be sent to nearby government facilities where their condition could be monitored regularly,” he said. According to him, apart from treatment, a few infected persons may need personal attention and care. If the number of patients goes up at the MCH, providing it could be difficult, he added.",,https://www.thehindu.com/static/theme/default/base/img/og-image.jpg,https://www.thehindu.com/news/cities/kozhikode/more-govt-hospitals-needed-to-treat-covid-19-patients/article32768229.ece
292,2020/10/05,Chief Minister inaugurates hostel buildings at Manonmaniam Sundaranar University,"Chief Minister Edappadi K. Palaniswami on Monday inaugurated, through video conferencing, new hostel buildings of Manonmaniam Sundaranar University on its main campus at Abhishekapatti in Tirunelveli.

At a simple function held at the university, Collector Shilpa Prabhakar Satish lighted the traditional lamp to mark the opening of the buildings, constructed on an outlay of ₹5.65 crore, in the presence of Vice-Chancellor K. Pitchumani.

Following administrative sanction given by MSU administration in May 2017, the men’s hostel was constructed in 3,122.65 sq m comprising the ground floor (1,055.05 sq m), first floor (1,033.80 sq m) and second floor (1,033.80 sq m).

The ground floor would have hostel office, security room and rooms 1 to 20, kitchen, dining hall and store room. The first and second floors would have rooms from 21 to 54. The second floor would also have 10 VIP rooms.

Physically challenged students would stay in ground floor, with ramps created for the purpose. Specially designed toilets had also been built for them.

The Chief Minister also inaugurated new buildings for MSU constituent colleges at Thisaiyanvilai and Panagudi, each constructed at a cost of ₹3 crore.

When the MSU administration was searching for land for constructing the building for its constituent college at Thisaiyanvilai, the then Radhapuram MLA, S. Michael Rayappan, donated land worth ₹5 crore for the purpose. The two constituent colleges had 13 classrooms and other facilities.",,https://www.thehindu.com/news/cities/Madurai/10fx5j/article32776388.ece/ALTERNATES/LANDSCAPE_615/MA06-HOSTEL,https://www.thehindu.com/news/cities/Madurai/chief-minister-inaugurates-hostel-buildings-at-manonmaniam-sundaranar-university/article32776389.ece
293,2020/10/05,"SP, wife hand over relief to tribal families","When the residents of Kalaimaan Nagar, situated near Karuppanadhi Dam deep inside the jungles of the Western Ghats beyond Chokkampatti saw a couple of police vehicles entering their colony on Monday, they were bewildered as nothing happened untoward there.

The residents, all Paliyar Scheduled Tribes, could not understand the reason behind the sudden entry of police into their hamlet.

When they saw Superintendent of Police Suguna Singh and his wife Dhanalakshmi getting down from the vehicle with a friendly smile, they were relieved.

“We have come to meet you, especially your children,” Mr. Singh told the residents of Kalaimaan Nagar, housing 22 tribal families with 137 members comprising 74 men, 63 women including four pregnant women.

The purpose behind the top cop’s visit to the jungles along with his wife was to meet the tribal people living deep inside the forest and help them with the contributions mobilised by the IPS Officers Wives’ Association (IPSOWA) – Tamil Nadu and Tenkasi District Police.

On seeing the friendly policemen, the men and women started gathering at a point and Ms. Dhanalakshmi handed over bedsheets and other essential commodities, jointly sponsored by IPSOWA – Tamil Nadu and Tenkasi District Police.

“On behalf of the IPSOWA, we gave the tribal people blanket and grocery. If this small contribution of IPSOWA may bring them happiness, it is the happiest moment for all of us,” Ms. Dhanalakshmi said.

When the officials went to Kalaimaan Nagar, connected by badly damaged road, to distribute relief material after COVID-19 outbreak, none could be seen in their houses as the tribes had already shifted their families to the deepest parts of the forest fearing the pandemic.

After a lot of hesitation, they returned to Kalaimaan Nagar where they were housed in Public Works Department building as their houses were under construction.

After Collector G.K. Arun Sundar Thayalan saw their pathetic condition, he ordered construction of 22 green houses for them after removing the dilapidated structures in which they were living.",,https://www.thehindu.com/news/cities/Madurai/vipi44/article32776360.ece/ALTERNATES/LANDSCAPE_615/MA06-OFFICER,https://www.thehindu.com/news/cities/Madurai/sp-wife-hand-over-relief-to-tribal-families/article32776361.ece
294,2020/10/05,Farmers’ association extends support to Palaniswami’s candidature to CM post,"Even as the weekly grievance redressal meet was under way at the Collectorate on Monday, a group of farmers affiliated to Vijayanarayanam Irrigation Tank Farmers’ Association staged demonstration in support of Chief Minister Edappadi K. Palaniswami’s candidature for the same post for next Assembly elections.

Led by association president R. Murugan, they raised slogans in support of Mr. Palaniswami.

They said the Chief Minister, who was executing kudimaramaththu works for desilting irrigation tanks and supply channels for the past three years, had revived farming operations in areas that remained uncultivable for several decades due to want of water.

The desilted tanks and supply channels, with increased storage of water, had expanded the area of cultivation.

“It has led to increase in farmers’ income. Hence, Mr. Palaniswami should be the next Chief Minister of Tamil Nadu,” said Mr. Murugan.

A petition submitted submitted by a group of people from Thiruvalluvar Nagar in Pettai appealed to the Collector to allow them to use a common path in their area.

They said residents, who were living in Thiruvalluvar Nagar since 1972, were using a common path adjacent to the Government Industrial Training Institute for the past 48 years.

Even after they constructed a temple in their colony in 1982, a section of residents used the common path to reach the place of worship without any resistance from any individual or an organization.

“Of late, the ITI administration claimed ownership of this common path after a compound wall was built around the institute. When the matter was challenged in court, we lost the legal battle. Hence, we appeal to the Collector to allow us to use the common path,” said P. Ramalakshmi, a signatory.",,https://www.thehindu.com/news/cities/Madurai/kh1smi/article32776321.ece/ALTERNATES/LANDSCAPE_615/MA06-CMSUPPORT,https://www.thehindu.com/news/cities/Madurai/farmers-association-extends-support-to-palaniswamis-candidature-to-cm-post/article32776324.ece
295,2020/10/05,MLA’s mother laid to rest,"Aruppukottai

The mortal remains of Rajamani Thangapandian, wife of former Aruppukottai MLA V. Thangapandian, and mother of MLA Thangam Thennarasu and MP Tamizhachi Thangapandian, were laid to rest at their native village Mallankinaru near here on Monday.

She passed away here on Sunday after a brief illness.

Hundreds of Dravida Munnetra Kazhagam cadre and functionaries took part in the funeral.

Among those who paid their last respects were former Union Minister M.K. Alagiri, MPs B. Manickam Tagore, Su. Venkatesan and P. Raveendranath Kumar, Communist Party of India State secretary R. Mutharasan, and functionaries from Bharatiya Janata Party and Marumalarchi Dravida Munnetra Kazhagam.",,https://www.thehindu.com/static/theme/default/base/img/og-image.jpg,https://www.thehindu.com/news/cities/Madurai/mlas-mother-laid-to-rest/article32775927.ece
296,2020/10/05,Five held with 22 kg of ganja,"A letter from the Editor

Dear subscriber,

Thank you!

Your support for our journalism is invaluable. It’s a support for truth and fairness in journalism. It has helped us keep apace with events and happenings.

The Hindu has always stood for journalism that is in the public interest. At this difficult time, it becomes even more important that we have access to information that has a bearing on our health and well-being, our lives, and livelihoods. As a subscriber, you are not only a beneficiary of our work but also its enabler.

We also reiterate here the promise that our team of reporters, copy editors, fact-checkers, designers, and photographers will deliver quality journalism that stays away from vested interest and political propaganda.

Suresh Nambath",,https://www.thehindu.com/static/theme/default/base/img/og-image.jpg,https://www.thehindu.com/news/cities/Madurai/five-held-with-22-kg-of-ganja/article32775893.ece
297,2020/10/05,HC seeks report on water harvesting scheme,"The Madurai Bench of the Madras High Court on Monday sought a status report on implementation of percolation ponds (pannai kuttai) water harvesting in Tenkasi district after a public interest litigation petition alleged misuse of the scheme

A Division Bench of Justices N. Kirubakaran and B. Pugalendhi sought the report in a PIL petition filed by L. Seenivasakan from Tiruvengadam in Tenkasi district who alleged that the funds allotted for the scheme was being misused. The petitioner, an agriculturist, said a stream in Naranapuram village passed through two survey numbers and ended in Nirpidikulam kanmoi and people in the region used water from the stream for irrigation.

Under these circumstances, private parties had colluded with an Assistant Executive Engineer and obtained loan for setting up a water harvesting pond. This pond was set up by encroaching the stream, thereby affecting the flow of water to the kanmoi.

The scheme was misused and the funds wasted. A representation was sent to the authorities concerned to remove the encroachments, but till date no action had been taken, the petitioner said.

The court has directed the District Legal Services Authority to inspect the stream and the implementation of the scheme.",,https://www.thehindu.com/static/theme/default/base/img/og-image.jpg,https://www.thehindu.com/news/cities/Madurai/hc-seeks-report-on-water-harvesting-scheme/article32775392.ece
298,2020/10/05,HC stays licence given for transporting water,"The Madurai Bench of the Madras High Court has stayed the licence granted for laying pipelines and transporting water from the ayacut lands of Cumbum valley in Theni district to non-ayacut lands.

Justice G.R. Swaminathan stayed the licence after a Theni-based farmers’ association representative, T. Vijay Rajan, filed a petition with a complaint of water theft in the region. In his petition, he said the Cumbum valley had a long history of paddy cultivation. But, water, a precious resource was being monetised by unscrupulous persons, thus affecting supply of water for irrigation.

Due to water theft, the livelihood of ayacut farmers of Cumbum valley had been affected. They had been denied a second crop in three of the last seven years, despite good rainfall and sufficient water being released from Periyar dam. Many officials either directly or by refusing to act against the water theft have contributed to the sufferings of the farmers and there was a deliberate mismanagement of water.

Though several representations had been sent to the government to act against the culprits, the theft of water and illegal pumping of groundwater were continuing, affecting cultivation in the region.

Water cartels had evolved due to the mismanagement. So the authorities must be directed to restrain the laying of pipelines in the Cumbum valley, the petitioner said.",,https://www.thehindu.com/static/theme/default/base/img/og-image.jpg,https://www.thehindu.com/news/cities/Madurai/hc-stays-licence-given-for-transporting-water/article32775319.ece
