,Date,Title,Content,Category,Image_link,Article_link
194,2020/10/05,“My son framed to save those behind civilian killings in Shopian”,"We were made to sign on blank pages, says arrested youth’s family

The family of one of the two persons arrested in the Shopian ‘fake’ encounter on Monday claimed their son “was being framed by the security forces and the family was made to sign on blank pages”.

“The Army picked up my son, Tabish Nazir, on August 12. Later, at the District Police Line, Shopian, a DSP, Wajahat Ahmed, tore our missing complaint. Instead I was asked to sign on a blank paper,” Nazir Ahmed Malik, father of Nazir, a farmer by profession, said.

Mr. Malik, who held a protest in Srinagar on Monday, said the police officer warned that “if they had not signed the blank his son would have been branded as a militant”.

“Now our son is being linked to the July 18 Shopian encounter. It’s said he gave information to the Army [about the presence of three militants]. It is a baseless charge,” Mr. Malik said.

Speaking during the protest, Mr. Nazir’s mother also claimed that “her son is being framed”.

“My son is being deliberately linked with the Shopian encounter to save those who killed three innocent labourers [from Rajouri],” she said.

Mr. Nazir is from Shopian and lives near the Army camp that carried out the operation on July 18. Three persons, described as three unidentified militants after the encounter, turned out to be three missing youth from Rajouri.

Mr. Nazir, along with another arrested person Fayaz Ahmad, a special police officer from Poonch who worked with a police officer in Srinagar, was arrested, questioned and produced before the local court on September 30 for judicial remand.

A police officer said they were being questioned “for their role in the encounter”.

Police sources said at least three locals are under scanner for their role in passing on any information about the presence of militants to the Army on July 17, which led to the encounter.

However, the local police’s role is also under the scanner for mentioning recoveries, including arms and ammunition, after the encounter.",,https://www.thehindu.com/news/national/other-states/wv2iqp/article32775129.ece/ALTERNATES/LANDSCAPE_615/SHOPIAN,https://www.thehindu.com/news/national/other-states/my-son-framed-to-save-those-behind-civilian-killings-in-shopian/article32775130.ece
195,2020/10/05,Ink thrown at AAP MP Sanjay Singh in Hathras,"FIRs filed against Bhim Army and RLD workers

The Aam Aadmi Party MP Sanjay Singh came under an “ink attack” on Monday outside Boolagarhi village in Hathras when he, along with a party delegation, was returning after meeting relatives of the victim who died after a brutal assault on September 29.

Mr. Singh and party MLA Rakhi Birlan were addressing the media when a youth identified as Deepak Sharma sprayed ink on them shouting, “brokers of PFI, go back.”

The Popular Front of India (PFI) is an Islamic fundamentalist organisation. Mr. Sharma is believed to be a member of the Rashtriya Swabhiman Dal.

Demanding justice and security for the family, Mr. Singh said the government seemed to be protecting the perpetrators of the crime. He described the CBI probe “as nothing but an eyewash.” The statement of the victim should be considered as her dying declaration. “It is enough to nail the accused,” he said.

FIRs filed

A day after Bhim Army chief Chandra Shekhar Azad visited the family of the woman who was brutally assaulted allegedly by four upper caste men, the Hathras Police lodged an FIR against him for violating Section 144. Around 400 workers of the Bhim Army have also been booked under Sections 147 (rioting), 341 (wrongful restraint), 269 (negligent act likely to spread infection), 270 and 188 of the IPC and section 3 of the Epidemic Act, 1897

An FIR, under similar sections of the IPC, has also been registered against unidentified workers of the Rashtriya Lok Dal. Police had lathi-charged RLD workers on Sunday after they tried to break the barricade outside the Boolagarhi village.

RLD leader Jayant Chaudhary, who was addressing a group of media persons, was saved by the workers who formed a shield around him. Mr. Chaudhary charged the police with being insensitive to the anguish that the incident has caused to the common people. On Monday, the RLD workers protested outside the village against the lathi charge on their leader. Similar protests were seen in different parts of the State, including Lucknow. A panchayat of jats was held in neighbouring Sadabad, an RLD stronghold, where the community expressed its anguish.

On the demand for security for the family by different delegations, Hathras SP Vineet Jaiswal told reporters that adequate security was already being provided and a section and a half of the Provincial Armed Constabulary (PAC) has been camping in the village. “One DSP rank officer, three SHOs and 15 constables have also been posted to maintain law and order. One sub-inspector and one constable have been sanctioned to be with the brother of the victim round the clock. Two woman sub-inspectors and six woman constables have been posted to guard the women in the family.” He said the security arrangement was being constantly reviewed by higher officials.

On Monday, he said, the SIT members visited the village again. “The local intelligence units have been activated to find out who tried to vitiate the social atmosphere in the area. “Nobody will be allowed to violate law and order,” he said.

MP denies charge

Meanwhile, Hathras MP Rajvir Diler denied on Monday that he went to meet the accused in the Hathras case in Aligarh jail on Sunday. Local media reports had questioned his visit to the jail, as images of him outside the jail went viral on Monday

Mr. Diler has been facing the ire of both the Valmikis and the upper castes after the incident. While the Valmikis allege the MP had not been able to safeguard the interests of his own community, relatives of the accused say the MP’s daughter put out the names of the four accused on social media even before the police named them.

Mr. Diler clarified that he had asked the Chief Minister for a CBI inquiry and that he didn’t go to meet the accused inside the jail. “I went to meet the Aligarh SSP for some urgent work, but when I reached there, I was told that the SSP has tested COVID positive and was under quarantine. When I was returning, some party workers stopped me in front of the jail. Meanwhile, the jailer came out and requested that I have a cup of tea with him. I also wanted to talk to him regarding reducing the quantum of punishment of an aged inmate. It is baseless to associate me with the case. I didn’t go to the jail to meet the accused or anybody. I didn’t even think about it,” he said.

It was an attempt to spoil his image. “The CBI inquiry will reveal who is guilty and who is not,” he said.",,https://www.thehindu.com/news/national/other-states/qz04mr/article32367786.ece/ALTERNATES/LANDSCAPE_615/SanjaySinghAAP,https://www.thehindu.com/news/national/other-states/ink-thrown-at-aap-mp-sanjay-singh-in-hathras/article32774930.ece
196,2020/10/05,Congress demands judicial probe into Hathras gangrape,"Repeats call to dismiss DM who threatened victim’s family.

The Congress on Monday demanded a judicial inquiry into the Hathras gangrape incident and the immediate removal of the District Magistrate (DM) Praveen Kumar Laxkar, whom the victim’s family has accused of misbehaviour.

“First of all Yogi Adityanathji’s government must immediately dismiss the DM, who is on record, on a video threatening the family. He should not be given any other posting till it is thoroughly investigated at whose behest the DM went to the family and threatened them in the manner that he did,” All India Mahila Congress chief Sushmita Dev said at a press conference.

“Secondly, the family of the victim is also demanding a judicial inquiry by a sitting judge of the Supreme Court... It is shocking that an Special Investigation Team (SIT) was set up after 14 days and after the media and Opposition leaders, specifically Priyanka Gandhi-ji and Rahul Gandhi-ji met the victim’s family in Hathras, they ordered a CBI inquiry as damage control,” Ms. Dev said.

Social media outreach

The party also released a 9-minute video “Hathras: Fight for Justice” on the visit by Congress leaders to the victim’s family on Mr. Gandhi’s Facebook page and YouTube channel.

In the video, Mr. Gandhi is seen assuring family members that “none can remove [you]... because it is your house, your land. If they try to do so, I will be here”.

Also Read Hathras rape case: Kanimozhi to lead candlelight march

The social media outreach is aimed leveraging the growing traffic to Mr. Gandhi’s social media handles in the past few days.

Data shared by a Congress functionary shows that Mr. Gandhi’s followers on Facebook grew by 1,449% between September 25 and October 2.

Facebook page views of Mr Gandhi’s posts have gone up 712%, page likes by 1,130% and video views by 5,355% for the same 8-day period.",,https://www.thehindu.com/news/national/ix4nbf/article31263210.ece/ALTERNATES/LANDSCAPE_615/SUSHMITADEV,https://www.thehindu.com/news/national/other-states/congress-demands-judicial-probe-into-hathras-gangrape/article32774503.ece
197,2020/10/05,RJD MP flags extortion calls from mystery number,"Parties begin ticket distribution for first phase of Assembly poll.

The Rashtriya Janata Dal (RJD) on Monday sought a probe into calls to political leaders in the State from a BSNL number with the caller allegedly asking for money.

“Several leaders are regularly getting calls from a telephone number 0612-22117222 for money…this telephone number was, earlier, installed at party leader and former Chief Minister Rabri Devi’s official residence but it was disconnected in 2016,” said RJD leader and Rajya Sabha MP Manoj Jha.

Addressing the media at the party headquarters in Patna, Mr. Jha said enquiries with state-run telecom provider Bharat Sanchar Nigam Limited (BSNL) found that the number had been allotted to the State Forest Department in 2018 but was disconnected on March 18, 2019.

When The Hindu called the number, an error message was received, saying “please check your number and try again”. BSNL officials refused to make an official comment on the present status of the telephone number.

“We’ve asked BSNL for complete details of this phone number,” said Mr Jha.

“Several leaders are getting phone calls on various dates from this number asking for ₹20 lakh, ₹30 lakh and ₹50 lakh…we ask the government who is making such calls and who this number has been assigned to,” the RJD leader said.

“Such nefarious design would not have been possible without the consent of those who are in power in the State…it is a complete criminal act and the government must probe this to find out who are the people behind this to implicate our leader Tejashwi Yadav,” he added.

He also said the ruling JD(U) is under threat of imminent defeat in the upcoming Assembly poll.

“On November 10 (when the election results are due) the face at 1, Anne Marg (Bihar CM’s official residence) will be changed and they must have become desperate and threatened,” he alleged.

Asked about an FIR lodged against party leaders Tejashwi Yadav and Tej Pratap and others in the murder of a Dalit leader in Purnia district, Mr. Jha said, “We’re waiting for the summons”.

“The government is yours (Nitish Kumar)…your police…then why to wait for any investigation into the case? But, you should not influence the probe,” he said.

“Headlines management, of which Nitish Kumar is said to be an expert, should also not be done in the investigation…hang Tejashwi Yadav if he is guilty but don’t influence the probe,” the RJD leader said.

Meanwhile, amid confusion between NDA partners BJP and JD(U) over seat sharing, the latter began issuing party ticket on Monday to candidates for the first phase of elections.

Over a dozen JD(U) MLAs and leaders were seen entering Chief Minister Nitish Kumar’s official residence and emerging with party ticket.

Similarly, RJD leaders and sitting MLAs were seen entering 10, Circular Road, the official residence of party leader and former CM Rabri Devi and returning with a party ticket to contest the poll.

The three Left parties CPI, CPI (M) and CPI(Marxist-Leninist) too distributed their party ticket among candidates.

In the Opposition mahagathbandhan or Grand Alliance, the CPI is contesting 6 seats, the CPI(M) four and CPI(ML) 19 seats while, the two major partners RJD and Congress party are contesting 144 and 70 seats respectively for the 243-member Assembly.",,https://www.thehindu.com/news/national/hbpp8e/article32759625.ece/ALTERNATES/LANDSCAPE_615/MANOJJHA,https://www.thehindu.com/news/national/other-states/rjd-mp-flags-extortion-calls-from-mystery-number/article32774334.ece
198,2020/10/05,"Shun JD(U) for your children’s welfare, says Chirag Paswan","LJP’s tough posture against Nitish puts NDA in a difficult situation.

A day after the Lok Janshakti Party announced that it will contest the Assembly poll outside the NDA while maintaining alliance with the BJP, party president Chirag Paswan wrote an open letter to the people of Bihar on Monday saying “even a single vote to JD(U) candidate will force your child to migrate from the State”.

The LJP’s tough posture against Chief Minister Nitish Kumar-led JD(U) has put the NDA in a difficult situation in the matter of allocation of seats.

“I know I am standing against powerful people, but at no cost will I allow ‘Bihar First, Bihari First’ thought of the party to diminish and will not accept defeat in any situation,” Mr. Paswan wrote in his one-page open letter.

“The decision the party has taken is not to rule Bihar but to take pride in it.”

The LJP leader recalled his ailing father in the letter. “Papa always used to tell me, don’t be afraid to walk alone. If your means and motives are right, people will come to you.”

“This [poll time] is a crucial moment for history of Bihar — this is a question of life and death of 12- crore people of Bihar as we don’t have time now to lose,” said Mr. Chirag Paswan. “The LJP’s ways are not easy but we’ll fight, and win as well.”

“I hope seeing my honesty, hard labour and integrity you all will bless the LJP candidates to make Bihar first.”",,https://www.thehindu.com/elections/bihar-assembly/n5fkum/article32765586.ece/ALTERNATES/LANDSCAPE_615/CHIRAGPASWAN,https://www.thehindu.com/news/national/other-states/shun-jdu-for-your-childrens-welfare-says-chirag-paswan/article32774067.ece
199,2020/10/05,Bypolls to three Assembly seats in Manipur on Novemeber 7: Election Commission,"The counting will take place on November 10.

Bypolls to three Assembly seats in Manipur would be held on November 7, the Election Commission announced on Monday. On September 29, the Commission had announced bypolls to two Assembly seats in Manipur.

With these fresh announcements, the total number of Seats going for byelection in the State goes up to five. All the bypolls in Manipur would be held on November 7 and counting will take place on November 10 along with that of the Bihar Assembly polls being held in three phases and 54 other Assembly bypolls taking place on November 3. Bypoll to the Valmiki Nagar Lok Sabha seat in Bihar is also taking place on November 7.",,https://www.thehindu.com/elections/bihar-assembly/yv2183/article32765310.ece/ALTERNATES/LANDSCAPE_615/NKV-ECI-LOGO,https://www.thehindu.com/news/national/other-states/bypolls-to-three-assembly-seats-in-manipur-on-novemeber-7-election-commission/article32773883.ece
200,2020/10/05,Man who robbed banks “to repay loans” held,"Police said he learnt a few tricks watching videos on the internet

A young man who allegedly robbed two banks to repay his loans, after learning a few tricks from the internet, has been arrested by the city police here.

The man had incurred heavy losses in his business venture in the wake of the COVID-19 pandemic.

Also Read | RBI loan restructuring plan: A difficult choice for borrowers

The accused was identified as Soumya Ranjan Jena (25), of Tangibanta village on the outskirts of Bhubaneswar. He robbed the two bank branches from where he had secured the loan, both located within three kilometres from his house.

“He had borrowed ₹19 lakh from the banks for an apparel and shoe shop. He was able to pay back ₹6 lakh. Our investigation found that his business transaction ranged between ₹9 lakh and ₹10 lakh per month before the lockdown. However, after the lockdown he found himself in a debt trap,” said Sudhansu Sarangi, Commissioner of Police for Bhubaneswar and Cuttack, on Monday.

“During the lockdown, he started watching videos on YouTube to learn how to carry out bank robberies. He bought an air-gun. Since he knew how the banks functioned, it was easy for him to target the two branches,” said Mr. Sarangi.

“He looted ₹12.34 lakh from the two banks. We have recovered ₹10.76 lakh from him. He told our investigator that he had no intention of robbing more. But our assessment is that he would have continued committing such crimes because it was easy money,” said the police chief.

He deposited ₹60,000 in his loan accounts and said he was planning to pay back the loans in phases to avoid suspicion. Police said the man belonged to a well-to-do family and had no previous criminal antecedents.

Also Read | Lockdown moratorium: Loans up to ₹2 crore may get relief

Cracking the case was not easy for the city police. Going by the crime records, bank robberies in Odisha are usually committed by miscreants from other States and they work in groups. Since the young man spoke Odia language and CCTV footages showed him being alone, police suspected that he was someone trying to enter the world of crime.

“It was a blind case. Police had no clue,” said Mr. Sarangi.",,https://www.thehindu.com/static/theme/default/base/img/og-image.jpg,https://www.thehindu.com/news/national/other-states/man-who-robbed-banks-to-repay-loans-held/article32773729.ece
201,2020/10/05,"Hathras case: FIR for bid to trigger caste-based conflict, sedition charge included","The FIR was lodged at the Chandpa police station on Sunday afternoon and names unknown as accused, according to police officials.

The Hathras Police have lodged an FIR against “unknown” persons for alleged attempt to trigger caste-based conflict and invoked serious charges, including sedition, officials said on Monday.

The development comes amid an undying controversy over the death of a 19-year-old Dalit woman after she was allegedly gang- raped, and continuous protests and visits to her village by political leaders and activists.

Also Read | A long caste feud, a horrific crime, and a sudden cremation

The first information report (FIR) was lodged at the Chandpa police station on Sunday afternoon and names unknown as accused, according to police officials.

The FIR mentions 19 charges under the Indian Penal Code (IPC).

The IPC sections include 124A (sedition), 505 (intending to cause public alarm and inducing someone to commit offence against state or public tranquillity), 153A (promoting enmity between different groups).

The police have also invoked section 67 (transmitting obscene material in electronic form) of the IT Act, according to the FIR.

The U.P. government’s statements and facts related to the Hathras incident are being forged, manipulated and circulated through social media. Misleading content is being shared with forged logos of media houses, a police officer said.

Also Read | No signs of intercourse, says forensic report

Some accused are circulating material that could trigger caste-based conflict and these are serious offences considering the current situation in the region, the officer said, adding the investigation is underway.

According to local officials, the Hathras police have so far registered around a dozen complaints under the IT Act related to the Dalit girl’s case and they are being probed by the Cyber Cell.

The Dalit teen had died of grievous injuries in a Delhi hospital on September 29, a fortnight after she was allegedly raped at her village by four upper caste men.

Also Read | Autopsy shows strangulation, fracture

She was cremated in the early hours of September 30. While the family claimed the cremation was carried out against their wishes, the police said the last rights in the dead of the night were held “as per the wishes of the family.”

The incidents have triggered massive outrage across the country, bringing severe flak for the government of U.P. which has now recommended a CBI probe into the whole episode.",,https://www.thehindu.com/news/national/other-states/p3z394/article32773532.ece/ALTERNATES/LANDSCAPE_615/UTTARPRADESHPOLICE,https://www.thehindu.com/news/national/other-states/hathras-case-fir-for-bid-to-trigger-caste-based-conflict-sedition-charge-included/article32773533.ece
202,2020/10/05,"Protest over Hathras case: Gujarat Congress MLAs, workers detained","A similar protest was held in Surat where around 20 Congress workers were detained, the police said.

Nearly 35 Gujarat Congress workers and two party MLAs were detained here on Monday after they held a protest without permission over the alleged gang- rape and death of a Dalit woman from Hathras in Uttar Pradesh, police said.

A similar protest was held in Surat where around 20 Congress workers were detained, they said.

Also Read | A long caste feud, a horrific crime, and a sudden cremation

The Congress held protests in all major cities of Gujarat as part of the party’s call for ‘satyagraha’ by its leaders and workers at district headquarters of states across the country against the BJP government in Uttar Pradesh to seek justice for the victim and her family.

In Ahmedabad, the protest was organised outside the collectorate and was led by city Congress president Shashikant Patel and MLAs Gyasuddin Shaikh and Imran Khedawala.

Apart from seeking justice for the victim, the opposition party condemned the alleged manhandling of senior Congress leaders Rahul Gandhi and Priyanka Gandhi Vadra by Uttar Pradesh police.

“The BJP government in Uttar Pradesh is trying to shield the culprits. And when our leaders went to Hathras to meet the victim’s kin, they were manhandled by the police,” Patel alleged before his detention.

Also Read | Hundreds gather at Jantar Mantar, demand Yogi Adityanath’s resignation

“As a responsible opposition party, we will not sit quiet against such lawlessness,” he added.

The city police said the Congressmen held the protest without permission.

“We have detained around 35 Congress workers. We will release them afterwards,” Ahmedabad’s Deputy Commissioner of Police Vijay Patel said.

Also Read | Upper caste group holds meet in support of accused

A similar protest was held outside Surat district collector’s office where around 20 Congress workers, including women, were detained, another police official said.

Uttar Pradesh Chief Minister Yogi Adityanath on Saturday recommended a CBI probe into the alleged gang-rape and death of the 19-year-old Dalit woman that triggered a nationwide outrage.",,https://www.thehindu.com/static/theme/default/base/img/og-image.jpg,https://www.thehindu.com/news/national/other-states/protest-over-hathras-case-gujarat-congress-mlas-workers-detained/article32772511.ece
203,2020/10/05,"Two CRPF jawans killed, three injured in Srinagar highway attack","Two Lashkar-e-Taiba militants came on a motorcycle and fired indiscriminately at a Road Opening Party: IGP.

Two CRPF jawans were killed and three others injured as two motorcycle-borne militants opened fire on a CRPF patrol on the outskirts of Srinagar on Monday afternoon.

“Two Lashkar-e-Taiba [LeT] militants came on a motorcycle and fired indiscriminately at a Road Opening Party of the CRPF at Kandizal near Pampore. Two CRPF men died in the incident and three others sustained injuries, who are stable”, Inspector General of Police (IGP) Vijay Kumar said.

The militants were chased by a joint team of the Army and the CRPF after the attack, which took place near the Srinagar-Baramulla highway. However, the attackers managed to escape.

“The attackers were identified as Saifullah, a Pakistani militant, and the other a local. A hunt is on to track them down. I am hopeful they will be neutralised soon,” Mr. Kumar said.

The deceased CRPF jawans were identified as Shailendra Singh and Dhirendra Tripathi, both belonged to the 110 Battalion.

‘Highway is vulnerable’

Mr. Kumar said the militants tend to attack near the national highway “because they find it easy to target the security forces”. “Highway is a busy place where hundreds of civilian vehicles pass every day. If we retaliate and fire indiscriminately too, there will be civilian casuality,” he noted.

This is the second major attack in the area this year. Two policemen were killed in a similar attack on August 13 in the area.",,https://www.thehindu.com/static/theme/default/base/img/og-image.jpg,https://www.thehindu.com/news/national/other-states/2-crpf-jawans-killed-3-injured-in-srinagar-militant-attack/article32771701.ece
