,Date,Title,Content,Category,Image_link,Article_link
97,2020/10/05,Kottigehara residents observe bandh demanding road repairs along NH 73,"The residents of Kottigehara in Mudigere taluk on Sunday observed a bandh demanding the repair of the Charmadi Ghat stretch of National Highway 73 (Mangaluru-Villipuram) that connects Chikkamagaluru with Dakshina Kannada district. For the last two years, movement of vehicles on this stretch has been hit by repeated heavy rains and landslips.

The growers, hoteliers, businessmen of Kottigehara had called for a bandh on the day to pressurise the State government and elected representatives to repair the road. They also took out a protest march on the highway from Kottigehara. As of now, the movement of heavy vehicles has been banned on the stretch, affecting business.

Hasanabba, a hotelier at Kottigehara, said that for the last two years, the hoteliers and owners of petrol bunks and other activities had no business, as the road was closed for many months. “The road offers major connectivity for Dakshina Kannada and the rest of the State. Every day trucks carry vegetables from Chikkamagaluru to Dakshina Kannada. Besides, the people of Mudigere taluk send their children for studies to Dakshina Kannada and for healthcare, we travel to Mangaluru or Manipal via this route. Whenever the road is closed, we face hardships,” he said.

The protesters maintained that earlier too landslips had occurred on the stretch but it was restored without much delay. “Now, despite having advanced technology and heavy machinery, the National Highways wing of the Public Works Department has not been able to take up the work to strengthen the road. We, the residents of Kottigehara, demand that the government and elected representatives attend to this issue,” said Sanjay Gowda, who led the protest.",,https://www.thehindu.com/news/national/karnataka/t69sqz/article32768544.ece/ALTERNATES/LANDSCAPE_615/04BGHASSANBANDHP3,https://www.thehindu.com/news/national/karnataka/kottigehara-residents-observe-bandh-demanding-road-repairs-along-nh-73/article32768545.ece
98,2020/10/05,ED summons Kerala CPI(M) leader’s son in drugs case,"Bineesh Kodiyeri has been asked to appear before the agency on Oct. 6

The Enforcement Directorate (ED), probing the finances involved in a narcotics racket that was recently busted by Narcotics Control Bureau (NCB) in the city, has summoned Bineesh Kodiyeri, son of Kerala CPI(M) State secretary Kodiyeri Balakrishnan for interrogation. He has been asked to present himself before the agency in the city on October 6, Tuesday.

The NCB had busted a narcotics ring and arrested two peddlers from a flat in Kalyan Nagar on August 21 - Mohammed Anoop and R. Ravindran, both from Kerala. NCB sleuths had seized 145 Ecstasy pills from the flat. Their interrogation and follow-up action based on the leads they provided led to large seizures and arrest of another peddler Anikha. D, whose clientèle included many from the Kannada film industry.

The ED, which is looking into the finances of these peddlers and their sources for money laundering and hawala transactions, had recently conducted an audit of their finances, questioned them and recorded their statements at Parappana Agrahara Central Prison, where they are currently lodged.

“Mohammed Anoop in his statement has said Bineesh Kodiyeri had lent him ₹50 lakh. We will question him as to what are his links with a peddler, for what purpose was the money given, what was the source of this money and whether he has declared it in his financial statements,” a senior ED official said.

Gold smuggling case

The ED had earlier questioned Bineesh Kodiyeri in connection with the gold smuggling case in which gold was being smuggled through diplomatic channels at the Thiruvananthapuram airport, in Kerala on September 9.

In documents submitted to a court in Kerala, the ED has claimed there are suspicions that the accused in the drug racket busted by NCB in Bengaluru may have helped accused in the gold smuggling case in Kerala.",,https://www.thehindu.com/news/national/karnataka/vccv50/article32768531.ece/ALTERNATES/LANDSCAPE_615/04BGBINEESHKODIYERIP3,https://www.thehindu.com/news/national/karnataka/ed-summons-kerala-cpim-leaders-son-in-drugs-case/article32768532.ece
99,2020/10/05,Civil Services preliminary examinations held,"Many say the paper was tough

The Union Public Service Commission (UPSC) conducted the civil services preliminary examinations on Sunday with a slew of precautions in place. Many candidates who appeared for it said they found the paper tough.

“Due to the pandemic, the exams were delayed for over four months. There were many guidelines in place. I found the preliminary exam tough. The questions were tricky and analytical,” Haricharan, a candidate from Bengaluru, said.

Candidates were allowed inside the exam centres after temperature checks and hand sanitisation. However, norms of social distancing prior to entering the exam hall were not followed strictly at some centres, said several students who took the test.

Another aspirant said, “I expect the cut off will be lower this year. Questions asked from polity, environment and other subjects were analytical and required more time to answer.”

The preliminary examinations were initially scheduled to be held on May 31, but got postponed to October 4 due to the pandemic. “Unlike previous years, there was uncertainty over conducting the preliminary exams. This has also impacted our preparation,” said another candidate.",,https://www.thehindu.com/news/national/karnataka/9kc350/article32768501.ece/ALTERNATES/LANDSCAPE_615/05BGUPSC,https://www.thehindu.com/news/national/karnataka/civil-services-preliminary-examinations-held/article32768502.ece
100,2020/10/05,Musicians too work from home in times of COVID-19,"The COVID-19 pandemic-induced lockdown and the changed work culture may have been painful for many, but it has turned out to be a boon for some.

Himanshu Prakash, a young music technologist from Mumbai, has shifted to his home town of Dharwad and has begun working from home. “It has been such a pleasure!” he declares as he tunes his guitar to sync it with his electronic piano and other instruments. Sitting in the second floor of his house, he fiddles on his laptop, plays on the piano, adjusts the guitar strings, and checks the ultra-sensitive microphone while humming a tune set to Hindustani music.

He has received several pieces of instrumental and vocal music sent to him online by his team members from Mumbai, Bengaluru, and Delhi. He slits them as if they were pictures or video clips, and pastes them over each other. What comes out at the end is a complete musical number with sounds of instruments in the background and the leading voices treated and processed by software tools.

“The slow pace of this town, the nearly silent surroundings, and the near-zero visitors to our house because of the lockdown has increased my productivity. You can never get such an ambience in Mumbai,” he says. “COVID -19 has forced music technologists, otherwise bound to their high-tech studios, to work from home with minimal equipment and new-age software.”

“The whole music team meets online to discuss projects. We divide our work, as though we were employees on an assembly line. Each one does his bit like singing a song, playing an instrument, or recording such performances, as per the music director’s instructions. Then those pieces are sent to technologists like us who sew them together, enhancing or diminishing some sounds, eliminating noise, and adding echo or effects. The final product seems as if it were created in one room with all the stakeholders sitting across the same table,” he says.

Mr. Prakash is a trained music technologist and a reference music director. He is also a trained Hindustani classical musician and has worked on several film and TV projects and advertisement campaigns. He was noticed for his work as an assistant music consultant for Bandish Bandits, the hit streaming series.

He thanks his parents Sunanda and Prakash Bhat for letting him choose his calling. “They sent me on a 12-month sabbatical after my SSLC. A friend and I went around the country volunteering for NGOs and engaging in adventure sports and fun activities. The trip helped me choose music. I went to Bengaluru after my pre-university course and then to Mumbai,” he says.",,https://www.thehindu.com/news/national/karnataka/unhdrq/article32768163.ece/ALTERNATES/LANDSCAPE_615/05BGHIMANSHUPRAKASH,https://www.thehindu.com/news/national/karnataka/musicians-too-work-from-home-in-times-of-covid-19/article32768164.ece
101,2020/10/05,Handlooms across Karnataka are now weaving a sad tale,"Stocks have piled up and with no work forthcoming weavers are migrating

For more than a month now, 20 handlooms of Yellanna Ganti, at Kerur in Badami taluk, have fallen silent and the skilled weavers working on them have lost their livelihood.

Mr. Ganti’s Banashankari Handloom Production Unit has piled up a stock of 6,000 metres of fabric as it has reported very poor sales in the post-lockdown months.

Mr. Ganti, who produced an average of 3,000 metres of handloom a month before the lockdown, has stopped production and is now focused on clearing his stock to generate capital to restart his unit.

‘Out of work’

“I feel very bad as weavers have been out of work for more than a month now. I have stocks but no cash to pay weavers. Only if I clear the stock can I get money to restart the looms,” Mr. Ganti told The Hindu over phone.

“The younger generation of weavers has left and those who are still in villages are those who cannot migrate. My biggest worry now is how to provide them work,” he said.

Similar stories echo from different weaving clusters in Bagalkot, Gadag, and Yadgir districts which have a high number of weavers. Already, the weaving community has shrunk significantly as per the 4th Handloom Census 2018-2019, conducted by Union Ministry of Textiles, and the COVID-19 crisis is another blow.

Mudhol-based Dhaneshwari Kaimagga Nekarara Batte Utpadakara Ghataka, a self-help group (SHG) in Bagalkot, has unsold stock of 5,000 metres, while the monthly production has come down from an average 5,000 metres to about 2,000 metres. “We never faced a situation like this. We have tried different products too but they have not yet received market acceptance,” said Shivashankar E. Moodalagi of the ghataka.

Shivamogga-based Charaka Women Weavers’ Cooperative has a stock pile of nearly 80,000 metres.

A serious consequence of the current situation has been that weavers, not finding work in their villages, have started migrating in search of jobs.

“If we stop weaving completely, weavers will go away. Many other jobs yield better wages and are less strenuous. We are struggling to give them work,” said Mallikarjun Rawat of Shahpur-based Shambhavi Kaimagga Nekarara Sangh in Yadgir district.

“Of the 50 weavers we had, 20 have left. We will have to run around to get weavers if all of them leave,” he added.

Cancelled orders

Gajendragad-based Sri Banashankari Nekarara Sahakara Sangh has not only seen high stocks, but also cancellation of existing orders, resulting in finances going haywire.

“Despite the crisis, we continue to give some work because if we let the weavers go, we have to shut the looms permanently. We have to show interest in retaining the talent. As it is, the younger generation is not interested in weaving,” said sangh secretary Ambareesh R.S. “In fact, due to capital crisis, many societies are near closure. After the current crisis, the number of active weavers may come down further.”

Of the 50 weavers attached to the Dhaneshwari Kaimagga in Mahalingapur, at least 15 are expected not to return.",,https://www.thehindu.com/news/national/karnataka/ab2za6/article32768113.ece/ALTERNATES/LANDSCAPE_615/5BGWEAVEADA,https://www.thehindu.com/news/national/karnataka/handlooms-across-karnataka-are-now-weaving-a-sad-tale/article32768115.ece
102,2020/10/05,Lyricist Kalyan blames ‘astrologer’ for turmoil in his family,"Kannada film lyricist K. Kalyan has alleged that an “astrologer” had abducted his wife and parents-in-law.

He said at a press conference here on Sunday that he had filed a police complaint against Shivanand Wali, a self-proclaimed astrologer from Bilagi in Bagalkot district, currently living in Belagavi. Mr. Kalyan, in the complaint, said that Mr. Wali had abducted his wife, Ashwini, and her parents, Radhika and Krishna Satvik.

It was alleged in the complaint, filed on Saturday, that Mr. Wali had hypnotised the trio and forced Mr. Krishna to transfer ₹19.8 lakh to his bank account. The “astrologer” had also forced Mr. Krishna to transfer his property to him, Mr. Kalyan said.

Under the influence of the “astrologer”, the Satviks and their daughter had left Bengaluru and were living in Belagavi, the lyricist alleged. The Satviks, who hail from Belagavi, had shifted to Mr. Kalyan’s residence last year.

Mr. Kalyan charged that Ganga Kulkarni, a cook in his house in Bengaluru, had sowed the seeds of discord in his family. The cook and the “astrologer” allagedly influenced Ms. Ashwini, resulting in her treating Mr. Kalyan as a stranger.

He, however, said that he loved his wife and was hopeful of a reconciliation. “I am sure her behaviour will change if she is counselled. I am confident of regaining her affection. I will write a love song for her and and make her sing it,” he said.

Investigating officers, meanwhile, said Ms. Ashwini had contradicted Mr. Kalyan’s claims. She met inspector B.R. Gaddekar of Mala Maruti police station and told him that the couple were facing problems in their marriage. She also dismissed the charge of abduction, the police said.

She alleged that her husband had subjected her to mental agony and was not carrying out some marital responsibilities. The couple are fighting a divorce case in the family court in Belagavi.

Following Mr. Kalyan’s complaint, Mr. Wali was arrested. Police Commissioner K. Thiyagarajan said the city police were focusing on the financial transactions and property transfer. “Our officers are trying to find out if it was done under duress or if it was a case of fraud, as has been alleged,” he said. He added that the police would not interfere if the case was of civil nature.

He said the women’s helpline in the commissionerate had referred Ms. Ashwini to counsellor Sandeep Patil.

Family meetings

Meanwhile, family members of Mr. Kalyan on Sunday held a series of meetings to resolve the problem between the lyricist and his spouse.

Mr. Kalyan’s brother and sister-in-law met Ms. Ashwini’s parents and other relatives in a bid to end the troubles in the family.",,https://www.thehindu.com/news/national/karnataka/oi2r0o/article32768096.ece/ALTERNATES/LANDSCAPE_615/05BGKALYAN,https://www.thehindu.com/news/national/karnataka/lyricist-kalyan-blames-astrologer-for-turmoil-in-his-family/article32768097.ece
103,2020/10/05,"One year on, this family is still in a relief camp","Providing alternative facility delayed

It has been more than a year since a family of Chickpet near Hosanagar moved to a relief centre after their house collapsed during heavy rains in August 2019.

Even as the locality was battered by another spell of heavy rains this year, the family continues to remain in the relief centre, thanks to a delay in providing them with an alternative facility.

The four families settled at Chickpet were badly hit during the heavy rains last year. The residents are daily wage workers with no land to cultivate.

A house collapsed completely, while three other houses developed cracks, forcing them to move out. The local administration set up a relief centre at a government quarter meant for Health Department staff, which was unoccupied, for them.

A couple of days later, when the rains receded, three families, headed by Suresh, Udaya and Subramanya, returned to their places, while Sumitra Bangari’s family remained at the centre as their house had collapsed completely. Many officers, elected representatives visited the place and promised the affected families of relief. As none of the four families had the land of their own, they could not get the relief amount meant for repair or construction of a house.

The recent rains also battered the village again. Ms. Bangari, who stays with her two children in the relief centre, said she had appealed to local panchayat officials and Revenue Department repeatedly for a solution to the problem.

“Whenever we raise our demand, the officers ask us to remain in the relief centre until an alternative arrangement is made. How long should we continue to stay there?” she questioned.

All four families have appealed to the district administration to provide them with permanent relief.

Shivamogga Deputy Commissioner K.B. Shivakumar visited the village recently and spoke to the affected people.

He said that efforts were being made to identify three acres of land for Ashraya sites in the village.",,https://www.thehindu.com/static/theme/default/base/img/og-image.jpg,https://www.thehindu.com/news/national/karnataka/one-year-on-this-family-is-still-in-a-relief-camp/article32768076.ece
104,2020/10/05,Better surveillance brings to light more poaching cases,"Five such cases were detected on M.M. Hills in September alone

Increase in surveillance and monitoring has led to a surge in the detection of poaching cases in M.M. Hills Wildlife Sanctuary in recent months.

As many as five cases have been detected during September alone, including one of the biggest racket involving trading in wildlife derivatives that has led to the arrest of seven persons so far.

Recently, another poacher was nabbed in the Hanur buffer zone and 20 kg of deer meat was seized. The accused, Muruge Gowda of Kanchalli village in Hanur taluk, Chamarajanagar district, was produced in court and remanded in judicial custody. A search is on for four of his accomplices in crime.

Villages abutting the M.M. Hills Wildlife Sanctuary and the Cauvery Wildlife Sanctuary have a history of poaching for meat.

Local residents had a free run during the heyday of brigand Veerappan when the area was out of bounds for the Forest Department.

But recently, the wildlife wing and the territorial divisions have reclaimed the administrative writ and have clamped down on poaching. Wildlife activists aver that such crackdown will act as a deterrent and these numbers will decline gradually.

“This is a social issue and cannot be resolved overnight but villagers are now aware that killing wildlife for meat is illegal and can land them in prison. Yet, there are individuals who are unable to resist it and this is being addressed through increase in surveillance,” said V. Yedukondalu, Deputy Conservator of Forests, M.M. Hills Wildlife Sanctuary.

The local intelligence gathering mechanism has also been strengthened and now the authorities have information about individuals with weapons. “We have a list of individuals who own country-made weapons and will ask them to surrender it,” said Mr.Yadukondalu.

Though there were similar efforts in the past, the department would fall short in collecting evidence admissible in court and the poachers would go free.

“But now we have invited legal experts to train our staff for drafting the case and also collect and present evidence which will increase the conviction rate in the future,” the official said.

There are proposals to increase anti-poaching camps in the M.M. Hills Wildlife Sanctuary, whose notification and upgrade as a tiger reserve is a matter of formality.

M.M. Hills is contiguous to the Cauvery Wildlife Sanctuary and the BRT Tiger Reserve and is a biodiversity hotspot.

Forest protection is the key to ensuring an increase in the number of carnivores like tigers.

“We have 40 anti-poaching camps [each manned by five persons] at present and it is proposed to increase it to at least 50,” said Mr. Yedukondalu.",,https://www.thehindu.com/static/theme/default/base/img/og-image.jpg,https://www.thehindu.com/news/national/karnataka/better-surveillance-brings-to-light-more-poaching-cases/article32768043.ece
105,2020/10/05,Karnataka bypolls: Parties in final stage of selection of candidates,"D.K. Ravi’s wife front runner for Congress ticket

Amid speculation over H. Kusuma, wife of the deceased IAS officer D.K. Ravi, trying her luck with Congress ticket to contest from Rajarajeshwari Nagar, the party high command is set to decide on the candidates for the two Assembly constituencies going into bypolls.

“We have had several rounds on discussions on who the party’s candidates should be in the two Assembly constituencies. We are sending the list of probable candidates to the high command today. The national leaders will decide,” Karnataka Pradesh Congress Committee president D.K. Shivakumar said on Sunday, as Ms. Kusuma and several local leaders from Sira constituency joined the Congress.

Ms. Kusuma is the daughter of Janata Dal (S) leader Hanumantharayappa, who also joined the Congress on Sunday, and is learnt to be keen on contesting from R.R. Nagar, which has a sizeable number of Vokkaliga voters.

The Congress State unit has backed six-time legislator and former Minister T.B. Jayachandra to contest for the Sira seat, which has now fallen vacant following the death of JD(S) legislator B. Satyanarayana. Party sources said that while only Mr. Jayachandra’s name has been sent for Sira, three names, including that of Ms. Kusuma, has been proposed for R.R. Nagar. The other two potential candidates are former legislator from Magadi Balakrishna and Raksha Ramaiah. “Ms. Kusuma is most likely to get ticket,” a source said.

“The entire State is waiting for the decision of the Sira voters,” Mr. Shivakumar remarked, adding that the Congress leadership was fully behind Mr. Jayachandra.

The Congress on Sunday distributed B-forms to its nominees in the Legislative Council elections. Mr. Shivakumar distributed the forms to R.M. Kuberappa (West Graduates), sitting member Sharanappa Mattur (North East Teachers), and Praveen Peter (Bengaluru Teachers).

Is R.R. Nagar proving tricky for BJP?

The Bharatiya Janata Party’s choice of candidate for Rajarajeshwari Nagar Assembly constituency has kept everyone guessing even as the party is expected to announce its candidates for the two constituencies going to bypolls either on Monday or Tuesday.

While it is speculated that Rajesh Gowda, son of former Congress MP Mudalagiriyappa, could finally bag the party’s ticket for Sira, it is the choice of candidate for R.R. Nagar that has kept everyone on tenterhooks. The R.R. Nagar byelection has been necessitated by the resignation of Congress legislator Munirathna, who was among the 17 Congress and JD(S) legislators to resign and cause the fall of the previous Congress-JD(S) coalition. There is quite a bit of resistance within the party to giving Mr. Munirathna the ticket, party sources said.

Sources said that the choice of candidate had become tricky because of the feud between Mr. Munirathna and Tulsi Muniraju Gowda, who could end up playing against each to ensure the other’s defeat, potentially costing the party the seat.

Meanwhile, on Sunday, Tourism Minister C.T. Ravi said that there was no confusion in the party over the choice of candidate, but acknowledged that there were many aspirants for the ticket. “No State leader, including the Chief Minister, has announced the name of the candidates so far. The BJP is stronger in R.R. Nagar. Even when D.K. Suresh was candidate, the BJP got more votes. We will win both constituencies,” he said, adding that he did not wish to comment on the possible candidature of H. Kusuma, wife of the deceased IAS officer D.K. Ravi.

A problem of plenty for JD(S) in Sira

The Janata Dal (Secular) is under pressure to retain the Sira Assembly seat after its legislator B. Satyanarayana passed away recently, but the party is faced with a problem of plenty with several candidates wishing to contest. This has delayed the selection of a candidate. The former Chief Minister H.D. Kumaraswamy had, last Thursday, announced that the party would declare its candidates for the two Assembly segments which are set to see byelections.

While the JD(S) is keen to give ticket to the widow of the deceased, the late legislator’s son Satyaprakash is learnt to be keen to contest. Before the election was declared, the JD(S) had said that the first priority in ticket distribution was to the family of the late Satyanarayana. However, when Mr. Kumaraswamy spoke at a public rally a day after the election schedule was announced, he was non-committal to the family.

However, on Sunday, Tumakuru Rural legislator D.C. Gowrishankar is learnt to have met the party supremo H.D. Deve Gowda to request ticket for his brother. Party sources said there were at least three serious contenders from the grassroots level in Sira, and they could emerge spoilsport for the party. Sunday also witnessed a large number of JD(S) workers from Sira joining the Congress, now helmed in the State by Vokkaliga leader D.K. Shivakumar.

Sources said the JD(S) was currently faced with not only problems related to the choice of candidates, but also other issues such as finances to meet the bypoll costs. The party’s R.R. Nagar candidate is also yet to be announced, sources said.",,https://www.thehindu.com/news/national/karnataka/5gs5wj/article32768037.ece/ALTERNATES/LANDSCAPE_615/05BGKUSUMA1,https://www.thehindu.com/news/national/karnataka/karnataka-bypolls-parties-in-final-stage-of-selection-of-candidates/article32768038.ece
