,Date,Title,Content,Category,Image_link,Article_link
291,2020/10/17,China’s rise and fall at the UN,"It’s an opportune time for New Delhi to push for institutional changes and reformed multilateralism in the global system

The United Nations turned 75 this year. In normal times, September would have seen a grand Summit in New York but because of the novel coronavirus pandemic, world leaders were forced to do with video messages to the UN General Assembly. The UN season, though, started on an auspicious note for India, with India besting China in the elections for a seat on the UN’s Commission on the Status of Women (CSW). This was the first such victory in a decade.

To add to China’s woes, soon after the CSW vote, it lost another election, this time to tiny Samoa for a seat on the UN Statistical Commission. And a couple of days ago, it just about managed to get elected to the UN High Rights Council, coming fourth out of five contestants for four vacancies. Earlier, China’s candidate had lost to a Singaporean in the race for DG World Intellectual Property Organization.

Also read | ‘Enormous divisions’: China cautious on G4 calling for UNSC reforms

China’s strengths

In 2011, India defeated China in a one-on-one election at the UN for a place on the Joint Inspection Unit. Thereafter, taking advantage of its position as a member of the P-5 and as a huge aid giver, China made itself invincible in UN elections, capturing, among others, the top positions at the Food and Agriculture Organization (FAO), the UN Industrial Development Organization (UNIDO), the International Telecommunication Union (ITU) and the International Civil Aviation Organization (ICAO). Indeed, India, too, felt this was a UN election behemoth not to be trifled with, and even as late as last year, pulled out its candidate against the Chinese from the race for the Director-General, FAO.

But how did China rise to this pre-eminent position at the UN. It all began, as is the case with India and multilateralism, a century ago with World War I. India was one of the largest contributors of soldiers in the war against Germany and Turkey and became a founding member of the League of Nations even though it was a colony. At the end of WWII, India participated in all the three UN conferences becoming a charter member of the UN even before Independence. Pakistan, on the other hand, joined the UN in September 1947 on application.

China saw an opportunity in World War I to rid itself of German occupation from some of its territory and allied with the United Kingdom and France. But they could not send soldiers as the Japanese, who were in competition with the Germans for the same Chinese territories, also allied against the Germans and refused to countenance Chinese troops in action. So, the Chinese sent large numbers of labour to support the western war efforts against Germany and won an invite at the Versailles Peace Conference. Things, however, did not turn out well as the West sided with the Japanese and China refused to sign the Versailles Peace Treaty.

Comment | China’s growing clout at the UN

The United States, though, was sympathetic to the Chinese cause, and a few years later helped reach a peace deal between China and Germany.

World War II saw strong U.S.-China collaboration against the Japanese, including U.S. operations conducted from India. An incidental but pleasant fallout of the stationing of U.S. forces in India was the establishment of ice-cream makers in India who, at the end of the war, bought the plants brought by the U.S. for its forces.

America’s ‘forgotten ally’

These old trans-Pacific linkages of the U.S. and China, including the presence of a very large Chinese community on the west coast of the U.S., are not well known, especially in India, but China is really “the forgotten ally” of the U.S. to use an expression coined by Oxford Professor Rana Mitter. This is important to bear in mind as the world, and India, pontificates the outcome of a U.S.-China contestation and its implications for multilateralism.

Their bilateral ties saw the U.S. include the Chinese in the ‘Four Policemen’, a group of the most important countries for ensuring world peace post- World War II, along with the real victors of World War II — the U.S., the USSR and the U.K. This number morphed into the P-5, with France being added by the UK at the San Francisco conference held in 1945 where the UN charter was finalised. The pure multilateralism of the League of Nations was thus infused with a multipolarity, with the U.S. as the sheet anchor.

The U.S. also thought that China would act as a bulwark against the USSR. But that was the Republic of China (RoC) led by the Kuomintang who were soon routed on the mainland by the communists and found themselves on the island of Formosa (now Taiwan). This is important as the People’s Republic of China (PRC) would have us believe that it was a founder of the UN.

Comment | A multilateral alternative, by Asia

RoC retained the UN seat of China till 1971 when it was expelled from the UN and the PRC admitted as a member giving it a de jure pole position at the UN. U.S. President Richard Nixon visited Beijing in 1972 and the U.S.’s opening to the PRC certainly paved the way for the unprecedented economic growth of China. However, in its march to global hegemony, the COVID-19 pandemic may have caught China on the wrong foot.

Institutional transformations

Multilateralism is under unprecedented stress fuelled by the COVID-19 pandemic and a certain disenchantment with globalisation. At the root, of course, is the rise of China and its challenge to U.S. global hegemony. But for global action there are no substitutes for multilateralism backed by strong multipolarity relevant to contemporary realities. This demands institutional reform and not just engagement with extant issues which form the song and dance of diplomacy.

Perhaps most important are institutional reforms in the UN Security Council (UNSC) and at the Bretton Woods Institutions so that their governance leverages the capabilities of the major players among both the developed and developing countries. In this context, it is good that recently India, Germany, Japan and Brazil (G-4) have sought to refocus the UN on UNSC reform. As proponents of reform, they must remain focused and determined even if these changes do not happen easily or come soon. This is also the way forward for India which is not yet in the front row.

Comment | Multilateralism post COVID-19

A window opens

Earlier in the year, India was elected as a non-permanent member of the UNSC for a two-year term. India will also host the BRICS Summit next year and G-20 Summit in 2022. These are openings for India in coalescing the world in critical areas that require global cooperation especially climate change, pandemics and counter-terrorism. India also needs to invest in the UN with increased financial contributions in line with its share of the world economy and by placing its people in key multilateral positions.

Three defeats and a near defeat for China in elections to UN bodies post-COVID-19 and the negative reaction to its threat of veto to forestall a discussion on the pandemic in the UNSC clearly point to a disenchantment with China in the globe and is a thumbs down for them. It is also an opportune moment for India and a Reformed Multilateralism.

Manjeev Singh Puri is Former Ambassador and Deputy Permanent Representative of India to the United Nations. The views expressed are personal",,https://www.thehindu.com/opinion/op-ed/nuyujc/article32876264.ece/ALTERNATES/LANDSCAPE_615/China,https://www.thehindu.com/opinion/op-ed/chinas-rise-and-fall-at-the-un/article32876265.ece
292,2020/10/17,Hope amid uncertainty: On IMF’s World Economic Outlook,"IMF calls for more international cooperation as the world economy recovers slowly

The IMF’s latest World Economic Outlook sums up the challenges ahead in the report’s title: ‘A long and difficult ascent’. With COVID-19 having already extracted a toll of over a million lives, accompanied by an evisceration of livelihoods and output in economies, prognosticating the economic future even as the pandemic rages on is an unenviable task. The Fund’s economists have gamely sought to make forecasts for world output through 2020, 2021 and into the medium term. While the global economy is projected to shrink 4.4% this year, reflecting a less severe contraction than the 5.2% drop estimated in June, output is seen rebounding at a marginally slower 5.2% pace in 2021. The IMF has based its revision on “better-than-anticipated second-quarter GDP out-turns, mostly in advanced economies” where activity improved after lockdowns were eased, as well as signs of a stronger recovery in the July-September quarter. But the IMF has been prudent in pointing out that even as the world economy ascends out of the depths it plunged to in April, following the worldwide lockdown, there remains the danger of a resurgence in infections that is prompting countries in Europe to reimpose at least partial closures. And the risks associated with predicting the pandemic’s progression, the unevenness of public health responses, and the extent to which domestic activity can be disrupted, magnify the uncertainty.

Pointing out that the pandemic is set to leave scars well into the medium term ‘as labour markets take time to heal, investment is held back by uncertainty and balance sheet problems, and lost schooling impairs human capital’, IMF Chief Economist Gita Gopinath contends that global growth will gradually slow to about 3.5% in the medium term. With the cumulative loss in output relative to the pre-pandemic projected path estimated to more than double to $28 trillion over 2020–25, efforts to improve average living standards are certain to be severely set back. Observing that the pandemic is set to widen inequality between economies and within nations, the Fund has urged greater international cooperation. It is imperative for all countries to work closely to ensure that new treatments and vaccines are made available to all since wider and faster availability of medical solutions could boost global income by almost $9 trillion by end-2025, reducing income divergence, she says. With no visibility yet on vaccine availability, the IMF has also stressed the need for policymakers to persist with direct income support for the most vulnerable and regulatory forbearance for stressed but viable firms. The message is clear. In a world as interconnected as it is today, the cost of economic insularity would only be more protracted pain for all.",,https://www.thehindu.com/static/theme/default/base/img/og-image.jpg,https://www.thehindu.com/opinion/editorial/hope-amid-uncertainty-the-hindu-editorial-on-imfs-world-economic-outlook-2020/article32876253.ece
293,2020/10/17,Valley’s voice: On J&K’s Gupkar alliance,"The Centre must respect the voices of reason and moderation in Kashmir

The announcement, on Thursday, by five regional parties and the CPI(M), of the formation of the ‘Peoples Alliance for Gupkar Declaration’ to fight for the restoration of full statehood and special constitutional status of Jammu and Kashmir, is one that has also coincided with the release of former J&K Chief Minister Mehbooba Mufti after 14 months in detention. The Gupkar Declaration by these parties, on August 4, 2019, had anticipated the Centre’s move to repeal J&K’s special status the next day and vowed to fight for its protection. J&K also lost its statehood. The NC, the PDP, People’s Conference, Awami National Conference, the J&K Peoples Movement, and CPI (M) have now reiterated their earlier pledge; the Awami Ittehad Party and the Peoples Democratic Front too have declared their support. The coming together of the rival regional parties is strange and significant; this is no electoral alliance, but a political meeting point on the status of Kashmir. It is a result of the perception that politics in J&K is a face-off with the Centre and a reflection of increased Kashmiri alienation from the national mainstream. The framing of Kashmir politics as a combat with the Centre has been forced upon the regional parties by the BJP government through its reckless policies.

In 2015, the BJP-PDP coalition government in J&K appeared like the maturing of a progressive trend. The BJP and the NC were in alliance at the Centre earlier. With two main national parties, the Congress and the BJP, forming opportunistic alliances with two regional parties, there were reasons to believe that politics in Kashmir was not out of step with the national mainstream. Besides participation of Kashmiri parties in national coalition governments, the debate within had begun to echo political debates elsewhere in the country — with development and governance increasingly taking centre stage. Debates on autonomy and self-determination continued, but did not overwhelm politics in Kashmir. As it turned out, alliances with regional actors did not temper the BJP’s strident opposition to the notional special status. It sought to delegitimise regional parties by terming them ‘soft separatists,’ and unleashed state agencies against them. J&K’s reorganisation in 2019 created new international dimensions. The BJP government at the Centre evidently believes that domination, not accommodation, is the way forward in Kashmir, which has helped the party’s electoral appeal in the heartland, and acts as an incentive. With sufficient amount of force, any policy is enforceable on the ground, but that is not a moral choice that democratic societies make. National integration advanced through patient negotiations and accommodation is more enduring and formidable. It is time for a new beginning in Kashmir and the Centre should be sensitive to the sentiments expressed in the Gupkar Declaration.",,https://www.thehindu.com/static/theme/default/base/img/og-image.jpg,https://www.thehindu.com/opinion/editorial/valleys-voice-the-hindu-editorial-on-jks-peoples-alliance-for-gupkar-declaration/article32876251.ece
294,2020/10/17,"State reports 7,184 cases, 71 deaths","The State on Saturday reported 7,184 new cases taking the total number to 7,58,574. With 71 new deaths, the toll rose to 10,427. This is apart from 19 non-COVID deaths.

A total of 8,893 people were discharged on Saturday taking the total number of recoveries to 6,37,481. Of the remaining 1,10,647 active cases, 940 patients are being monitored in the ICUs.

While the positivity rate for the day reduced to 7.7%, Case Fatality Rate (CFR) touched 0.98%.

Bengaluru Urban reported 3,371 cases taking the tally to 3,04,005. With 14 of the 71 deaths from Bengaluru, the toll in this district rose to 3,500. Active cases in Bengaluru touched 64,770.

As many as 1,01,016 tests were conducted in the last 24 hours, including 24,174 rapid antigen tests. With this, the total number of tests rose to 65,62,710.",,https://www.thehindu.com/static/theme/default/base/img/og-image.jpg,https://www.thehindu.com/news/cities/bangalore/state-reports-7184-cases-71-deaths/article32882291.ece
295,2020/10/17,Aditya Alva tells HC there is no recognisable offence by him; CCB says otherwise,"CCB says incriminating materials found on his property premises

The Central Crime Branch told the Karnataka High Court that certain incriminating materials like small quantity of psychotropic pills and ganja were seized from the premises belonging to Aditya Alva, one of the accused in the drug racket case allegedly involving Kannada actors.

Mr. Alva, in his petition before the court, claimed that the complaint in the drug case “does not even make a remote reference or whisper on any acts or omission or any recognisable offence by him under the provisions of the Narcotic Drugs and Psychotropic Substances (NDPS) Act.”

However, the CCB’s statement claimed that a few grams of pills and certain quantity of ganja were seized during the search at his property, House of Life, near Hebbal in the city, and contended that available materials and statements of other accused are sufficient to attract cognizable offence against him. The CCB had issued lookout notice against him, who is at large since registration of the case.

Justice Suraj Govindaraj, before whom the petition came up for hearing on October 16, has adjourned further hearing till November 13.

Degree from London

Stating that he holds master’s degree in International Diplomacy and International Law from SOAS College of University of London and a bachelor’s degree in International Politics from the University of San Francisco, Mr. Alva has alleged that, “without prejudice, he humbly believes that the police has sought to arraign him as one of the accused presumably due to the flood of rumours and false allegations that were peddled by media and certain politically motivated armed chair warriors who have attempted to wreak vendetta against him and his family members.”

Pointing out that he hails from a respectable family of politicians who made significant contributions to the State, Mr. Alva, a realtor by profession, said that he has been “painted with a brush of guilt, even before he has been afforded with an opportunity of being heard, by the hoi polloi in general and the media houses in particular solely on the score that a crime has been registered, which is, in fact, an act beyond the purview of the legal sphere.”

The highhanded acts of police have subjected him and his family members to unexplainable harassment besides causing dent to reputation of his family, he has alleged.",,https://www.thehindu.com/news/cities/bangalore/p2s2lv/article32607184.ece/ALTERNATES/LANDSCAPE_615/aditya,https://www.thehindu.com/news/cities/bangalore/aditya-alva-tells-hc-there-is-no-recognisable-offence-under-ndps-act/article32882285.ece
296,2020/10/17,SWD work keeps buses out of MTC terminus in Kovur,"Due to lack of easy access to the facility, the buses are now parked on Porur-Kundrathur Main Road

Stormwater drains along Porur-Kundrathur Main Road were widened recently, and the work involving the drain in front of the Metropolitan Transport Corporation (MTC) terminus in Kovur, has caused a new problem.

The exercise does not seem to have factored in how MTC buses could enter the terminus if the drain is two feet higher than the floor of the terminus. A narrow portion has been left untouched to let buses roll in and out of the terminus. However, this section being narrow, drivers can’t negotiate it with ease. As a result, buses are lined up outside the terminus.

With bus drivers fighting shy of using it, the narrow passage has been blocked with wooden logs to prevent motorists from parking their vehicles, including cabs and autorickshaws, inside the terminus. As buses now halt on the road, commuters are put to great inconvenience.

“When it rains, we take shelter inside the terminus and when the bus arrives, we have to run to board the bus which halts on the road,” says K. Saroja, a resident of Kovur.

Commuters say that the work exposes the lack of coordination between the government departments including the State Highways Department and the Kancheepuram Collectorate.

In this regard, an official from the Kancheepuram Collectorate says, “The height of the floor in the terminus will be increased so that movement of the buses will not be affected.”

The drain which is now three feet wide and six feet deep is meant to discharge excess rainwater from the surrounding locality to the Porur lake nearby and thereby prevent inundation on Porur-Kundrathur Main Road. The drains were widened following the construction of more than half-a-dozen culverts along the road. The localities along the road — Kundrathur, Kovur, Gerugambakkam and Porur — were severely hit by the 2015 floods. Hence, the stormwater drains were widened

Renovated at a cost of ₹7 lakh allocated under MLA Local Area Development funds of Alandur Assembly constituency in 2014, the terminus caters to residents of Kollachery, Arambedu, Erumaiyur, Kavanoor, Kolambakkam, Poonthandalam and Vaipoor. Every day, on an average, more than 120 services are operated from this terminus.

Many commuters prefer to travel to the Kundrathur bus terminus, around 2 km from Kovur, or to th Four Cross Junction, which is around one km away, to board buses as they are frequented by people round-the-clock. Besides, the police booth at the Kovur terminus is closed most of the time, especially at night, point out commuters.",,https://www.thehindu.com/news/cities/chennai/27te9i/article32880984.ece/ALTERNATES/LANDSCAPE_615/10dctngr-Kovur-MTC-Terminus,https://www.thehindu.com/news/cities/chennai/swd-work-keeps-buses-out-of-mtc-terminus-in-kovur/article32880985.ece
297,2020/10/17,A smart move,"Bharatanatyam has helped Ananth Raghunandan work through autism; and from United States, his family has come to India to ensure he gets the most out of the dance form

A few minutes into our conversation, Ananth Raghunandan’s right hand moves to take the form of a mudra. From his eye movement, it is clear that this comes spontaneously for this young dancer whose parents have come from Miami, United States, to fulfil his desire to have his Bharatanatyam arangetram in Chennai. Ananth and his family are now living in Kasturibai Nagar, Adyar.

What’s inspiring about this journey to Bharat through Natya, as the family calls it, is how Ananth beat the odds through dance. Twenty-two-year-old Ananth is on the autism spectrum, and his experience makes it clear that there is therapeutic value in movement.

It is eight years since Ananth started learning dance.

“I am a regular at the Music Season, not so much for the dance as for the fact that it helps Ananth. We did not chose Bharatanatyam for him; he chose it for himself,” says K. Raghunandan, Ananth’s father.

Guru Harija Sivakumar in Miami was his first guru. Later, professor K. Mohanan from Kalakshetra Foundation started offering him lessons.

“He had many sensory-motor challenges and was introduced to karate, hip-hop and tap in Miami, but nothing made as much difference as Bharatanatyam,” says Rama, Ananth’s mother.

On Ananth’s Bharatanatyam arangetram, she says, “The practice sessions were continuous and intense and we are glad Ananth completed this milestone.”

She points out that Ananth’s foot movement and rhythm are his strengths. She says due to regular dance practice his posture has improved tremendously. “I can see so many subtle changes in him — his eyesight is sharper and his hand-eye coordination has improved,” she says.

As Bharatanatyam is partly rhythmic chanting, it has helped in his speech too.

Ananth’s passion for Bharatanatyam led the family to explore more opportunities for him in India. Since the last two years, he has been pursuing a diploma programme in Hospital Record and Documentation Management at Dr. Kamakshi Memorial Hospital (KMH) thanks to encouragement from Dr. T.G. Govindarajan, chairman and managing director of the hospital.

Besides dance, Ananth is well-versed with the piano and actively codes for HashHackCode, an organisation that provides inclusive tech education and mentorship. Interestingly, Ananth’s website (ananthdance.com) was developed by Prem, a HashHackCode student with autism, in time for his arangetram.",,https://www.thehindu.com/news/cities/chennai/igwelh/article32880890.ece/ALTERNATES/LANDSCAPE_615/18dcAnanth-Raghunandan,https://www.thehindu.com/news/cities/chennai/a-smart-move/article32880891.ece
