,Date,Title,Content,Category,Image_link,Article_link
0,2020/10/17,Phone photo memory,"I don’t care for any phone details because what is phone? Phone means what?

Respected Madam/ Sir,

For three years, I am having same mobile phone. Same phone. It is Samsung phone. What is the memory? I don’t know. What is the processor? I don’t care. What is the operating theatre? Mannangkatti.

In office of your esteemed newspaper, maybe you people are thinking, oh my god we thought Mr. Mathrubootham is retired person but with lot of youth type outlooks. But whether actually he is Jambuvan period type who is still saying video tape and eight annas and watching Doordarshan?

Don’t speak like muttaals.

I don’t care for any phone details because what is phone? Phone means what? You put phone call, you put WhatsApp, put some videos, maybe call taxi. Finished. For that and all why I need biodata and horoscope and Aadhaar card of phone?

Total time waste. But some people will talk about phone as if marriage proposal. Marriage proposal even they will not do so much research. Memory is good but height is low. Boy’s height good but he has taken 11 years to do graduation. Very good family and very good house and very good neighbourhood but where is the megapixel?

Two months ago, Mrs. M bought one new mobile phone. And she did research for one day? Wrong. Two days? Wrong. One week? Wrong wrong. One month? Nonstop wrong. Madam/ Sir, she did research for full two months. I said, Kamalam, you are buying phone or once more doing M.Sc. in Zoology? She said, you please go and sit and play out-of-fashion games on your phone, my new phone is waterproof. I said, oh amazing, now you can watch Madhavan videos during bath also. She quietly looked at me and said: Correct. Any problem?

Why I am putting phone speech? This morning my son who is working from home came to me and said, Appa, please install one new app on phone. My company is developing. I said, ok, no problem. What app? He said, it is amazing new app for ordering food from nearby restaurants. I said, congratulations kanna, you have come up with brand new idea first time in India, please check if it is new idea in whole world.

He said, hahaha Appa, so funny. Alistair Maclean will write same move 35 times and you will read nonstop. But my app is problem-aa? In India no one will give money for new app. Originality and all for U.S. only. Please quietly give your phone.

Ten minutes later he said Appa, memory is finished. Please delete some items. I said, oh my god, please give me the funny intolerable headache.

Madam/ Sir, that is when unbearable sentiments are coming into the heart. I opened Google Photos and app is saying look at this photo from last year, from five years back, whether you have seen this photo, this one, what about this? Like that, like that.

And who is in these photos? Madam/ Sir, some old friends who are no more. Rajan from college. Thomas J.J. who was colleague in Ujjain branch. Some photos from get-together in Yercaud, 2012. Suddenly I am seeing photos and memories are coming like anything. For one hour I sat and looked at photos and photos.

Then I called Mrs. M. I said Kamalam, I want to buy new phone. This one memory is finished. I want more memory. She said why, you’re thinking of Suhasini videos? I said no, no, Kamalam, I want to keep photos safely forever. She said, no problem, old man. I will find one new phone. Give me two months.

Now I am waiting and taking care of old phone carefully.

Yours in reminiscences,

J. Mathrubootham",,https://www.thehindu.com/opinion/9l8ta2/article32869415.ece/ALTERNATES/LANDSCAPE_615/18-SM-phone,https://www.thehindu.com/opinion/phone-photo-memory/article32869416.ece
1,2020/10/17,OnePlus co-founder Carl Pei leaves the company after nearly 7 years,"During his tenure, OnePlus has launched several flagships, starting with the OnePlus One in 2014 to the most recent OnePlus 8T.

(Subscribe to our Today's Cache newsletter for a quick snapshot of top 5 tech stories. Click here to subscribe for free.)

Chinese smartphone maker OnePlus' co-founder Carl Pei confirmed on Friday that he is leaving the company he helped build.

“After nearly 7 years at OnePlus, I’ve made the difficult decision to say goodbye.” Pei said in a blog post.

During his tenure, OnePlus has launched several flagships, starting with the OnePlus One in 2014 to the most recent OnePlus 8T.

The company's first phone was dubbed a ""flagship killer"" as it offered features and specifications on par with other flagships.

“The world didn’t need another smartphone brand in 2013. But we saw ways of doing things better and dreamt of shaking things up,” Pei noted. “Better products. Built hand in hand with our users. At more reasonable prices,” he added.

In July, the company introduced its first mid-range smartphone OnePlus Nord, developed under Pei’s guidance. OnePlus had briefly experimented with OnePlus X, in 2015, however, Nord was specifically designed to compete in the mid-range segment.

Also read | India approves 16 companies, including top Apple suppliers, for smartphone plan

OnePlus has consistently offered products with premium build quality, high-end specifications at competitive prices. This has helped the company grow as a global brand with significant market share in major smartphone markets such as India.

OnePlus regained its top position in the Indian premium smartphone market with 29% share in Q2 2020, according to a report by research firm Counterpoint

Pei was 24 when OnePlus started. He says, “It’s where I spent most of my 20s, and also where I grew up.”

“I’m looking forward to taking some time off to decompress and catch up with my family and friends. And then follow my heart on to what’s next,” Pei adds.

According to a report by TechCrunch, Pei is reportedly starting a new venture, and is in talks with investors.",,https://www.thehindu.com/sci-tech/technology/6pnnf5/article32880981.ece/ALTERNATES/LANDSCAPE_615/oneplus,https://www.thehindu.com/sci-tech/technology/oneplus-co-founder-carl-pei-leaves-the-company-after-7-years/article32881117.ece
2,2020/10/17,Haldiram’s crucial data stolen; hackers demand ₹ 7.5 lakh to release information,"The company said its official raised a complaint with its data security and cyber security firm, Trend Micro, and alleged that all files and sensitive data of the firm had been encrypted by the hacker.

(Subscribe to our Today's Cache newsletter for a quick snapshot of top 5 tech stories. Click here to subscribe for free.)

Hackers have allegedly stolen crucial data of popular food and snack company Haldiram’s and have demanded ₹ 7.5 lakh for releasing the information which includes financial and sales details, according to Noida Police.

The unidentified accused hacked the server of the company based in the industrial Sector 62 of Noida using a cyber malware popularly called ‘Ransomware Attack’, the police said.

According to the FIR lodged at Sector 58 police station, the cyber attack took place on the intervening night of October 12 and 13 and the hackers may have stolen “entire or substantial data” of the company which runs several restaurants and outlets.

The complaint made by a Haldiram’s official said that an IT official of Haldiram’s consequently accessed the Firewall programme on the company’s servers and found some traffic generating from servers, showing certain IP addresses.

Also read | Hotel Wi-Fi networks favour guest convenience over strong security, FBI warns

“Finally, the officials of the company found out that some programme was being executed on the aforementioned servers and all the data of the company was being diverted from and going out from the servers of the company,” it stated.

“ Therefore, the said programme was immediately terminated by the officials along with the connectivity to all systems at branch locations of the company. However, it is apprehended that till the said disconnection was undertaken by the officials, may be the entire or substantial data may have already been stolen from the servers of the company,” it stated.

The company said its official raised a complaint with its data security and cyber security firm, Trend Micro, and alleged that all files and sensitive data of the firm had been encrypted by the hacker, thereby, preventing its officials from interacting with their files, data, applications and systems.

Also read | Hackers use fake Excel files to breach security

It said that the hackers, to give effect to a pre-planned criminal conspiracy, have not only stolen data from the servers and systems of the company but have also contacted company officials through certain servers to illegally extort money to provide back the access to the company’s own data and to delete the stolen data from the servers and systems.

The data includes but not limited to financial, HR, sales/purchase and other data/information)

A Haldiram’s representative claimed the hacker(s) have demanded a ransom of ₹ 7.5 lakh in order to decrypt the servers of the company including all its files, data, applications, systems, etc and delete the stolen data from their own systems.

The Noida Police said they have taken up investigation and its Cyber Cell is working on the case.

“The allegations have been found to be true by our Cyber Cell, which is now probing the case. Whatever points and facts emerge during the probe, the matter would be dealt with accordingly,” Additional Deputy Commissioner of Police, Noida, Ranvijay Singh said.

The FIR has been lodged against unknown accused under Indian Penal Code sections 420 (cheating), 384 (extortion) and under relevant provisions of the Information Technology Act, the police said.",,https://www.thehindu.com/sci-tech/technology/26phlc/article32434967.ece/ALTERNATES/LANDSCAPE_615/Data-breach,https://www.thehindu.com/sci-tech/technology/haldirams-crucial-data-stolen-hackers-demand-75-lakh-to-release-information/article32880074.ece
3,2020/10/17,"‘Today At Apple’ comes to India, lets customers harness the ecosystem from their homes","Launching October 17, ‘Today At Apple’ bridges the gap between the company and customers with many well-known names in the creative industries — a virtual twist, too

A month after Apple India launched its official online store, ‘Today At Apple’ is set to make its way into the brand’s consumer market, just in time for the iPhone 12 series’ entry into the Indian market. These are free educational sessions Apple offers, ranging in topics from photo and video to music, coding, art, design and more.

Launched in 2017, ‘Today At Apple’ sessions essentially bridge the communication gap between customers and the company so that the consumer experience with Apple’s range of products and services is personally enriched.

Held globally with the demographic in mind, these sessions are led by the company’s selected Creative Pros (who educate customers through hands-on experiences and now virtual experiences), and, at times, top-notch artists, photographers and musicians.The sessions range from basics and how-to’s, to professional-level programs. Consumers can expect lessons on GarageBand, Photo Lab and other applications.

Seasonal and entertaining

Obviously, owing to the pandemic, ‘Today At Apple’ has limited programming at most of the global Apple Store locations. That said, the company launched a digital version of these sessions called ‘Today at Apple @ Home.’

In line with the ‘Today At Apple’ diversity, one can also look forward to free educational programming through seasonal sessions like Apple Camp (summertime ‘camps’ where children can learn new ways to create with video, art and design, and coding), Made In LDN (a creative series on video, photography, art and design, supported by the Mayor of London, featuring artwork co-created with Art Against Knives), and International Day of the Girl (October 11).

In the past, international collaborations for ‘Today At Apple’ have also come from Billie Eilish, K-Pop boy-band NCT, Khalid, Alicia Keys, architecture firm Foster & Partners, photographer Christopher Anderson, Taylor Swift, and more.

Images shot on iPhone by Siddhartha Joshi and Anurag Banerjee

This time of physical distancing, sees many virtual collaborations with renowned creatives from the local market; Apple India’s set of artistes for the ‘Illuminating Creativity Series’ include distinguished photographers Siddhartha Joshi, Avani Rai, Anurag Banerjee, Prarthna Singh and Hashim Badani. Sessions hosted by these experts include ‘Personal Angles with Anurag Banerjee’ and ‘Shaping Photographic Narrative with Hashim Badani’.

Of course, musicians are part of the collaborative series: Raja Kumari, Prateek Kuhad, DIVINE, Lisa Mishra and Aditi Ramesh.

In your dialect...

In addition to India’s ‘Today at Apple @ Home’, gadget engraving will also be available from October 17 in English for AirPods, iPad and Apple Pencil, and in seven regional languages including Hindi, Gujarati, Marathi, Telugu, Bengali, Tamil and Kannada and emojis for AirPods. This is ideal for those who want a personal touch, and a little help distinguishing their devices from others’, especially in a household of multiple same-model devices.

Personalised AirPods engravings, in various Indian dialects and in English | Photo Credit: Apple Inc

Apple India’s ‘Today at Apple @ Home: Illuminating Creativity Series’ will run from October 17 till November 29; session sign-ups at https://apple.co/illuminatingcreativity.",,https://www.thehindu.com/sci-tech/technology/968avd/article32879582.ece/ALTERNATES/LANDSCAPE_615/sergey-zolkin-UeY8aTI6d0-unsplash,https://www.thehindu.com/sci-tech/technology/today-at-apple-india-october-17-virtual-twist/article32879583.ece
4,2020/10/17,"Weekly Bytes | Google’s accessibility features, Oxford’s ML-powered COVID-19 test, and more","Here's our curated list of important tech news from this week in byte size.

(Subscribe to our Today's Cache newsletter for a quick snapshot of top 5 tech stories. Click here to subscribe for free.)

Google’s Chromebook, G Suite for Education accessibility features

Google has improved accessibility features on Chromebooks and G Suite for Education to help students and teachers with disabilities. These include Select-to-speak; Speech Customisation; magnified cursors with seven colours; enhanced braille support with keyboard shortcuts, faster typing echo and screen reader navigation, live edits in Docs; live captioning in Meet; voice commands in G Suite for navigating, selecting, and editing in Docs; personalised real-time closed captions in Slides. In another update, Google's parent Alphabet has developed a robotic plant buggy to scan crops and generate data to help farmers grow food.

Oxford scientists develop ML-powered quick COVID-19 test

Scientists from Oxford University have developed an extremely rapid test that detects and identifies viruses in less than five minutes using machine learning (ML). It is able to differentiate with high accuracy SARS-CoV-2, the virus responsible for COVID-19, an Oxford release noted. After labelling of virus particles in a sample, a microscope captures images, which are then processed through the ML software to quickly identify the virus, it added. In another development, YouTube said it would remove videos containing misinformation about COVID-19 vaccines.

SpaceX aims to launch two Starlink missions in a week

SpaceX plans to launch two Starlink missions within a span of three days, the first one on October 18, and the next on October 21, CNET reported. The aerospace company’s Starlink satellite network has over 700 satellites in the low Earth orbit. CEO Elon Musk recently tweeted that the company plans to roll out a fairly wide public beta of the internet service in northern US and southern Canada. Its 13th mission was successfully launched last week after aborting the mission four times due to bad weather.

GitHub for mobile gets new features to improve code review

GitHub has added new features that make code review easier, faster, and more productive on mobile for iOS and Android. The features include an option to turn off line wrapping, always use dark theme, override system font size, change the email associated with a merge, edit the commit description, support for comments on multiple lines of code, new ‘Jump To’ icon to help larger reviews that span multiple files. In another development, Microsoft added instant video calling feature to its Edge browser.

Google Assistant support extends to more smart devices

Google has extended support of the Assistant to various smart devices from different brands. People will now be able to use the Assistant to automate tasks or control devices with voice on devices such as Lenovo’s Smart Clock, Samsung’s latest line-up of Smart TVs, Fitbit Sense and Versa 3 smartwatches, Nest speakers, Mi Smart Speaker and Bose Smart Soundbar 300. This week, Google Assistant also got a new feature that will help you find a song just by humming, whistling or singing a melody.

Microsoft to launch 30 optimised games for next-gen consoles

Microsoft has announced that it will be launching 30 fully optimised games for Xbox Series X and Series S, on day one. Gamers will be able to play games like Assassin’s Creed: Valhalla, Watch Dogs: Legion, Yakuza: Like a Dragon, Gears Tactics, and Tetris Effect: Connected, on their next-gen consoles on November 10. Out of the 30 new games, 20 will be available via Smart Delivery that are upgraded automatically. In another update, Microsoft this week said its AI captions images as accurately as humans do.

Snapchat introduces Sounds on iOS

Snapchat has introduced Sounds feature for iOS users across the globe. User will now be able to add music from a curated library to make their Snaps better. They have an option to add music both before and after capturing their Snaps. Also, people receiving a Snap with Sounds will be able to listen to the entire song on music streaming platforms such as Apple Music and Spotify.

WordPress introduces new feature to share content on Twitter

WordPress has introduced a new feature that allows people to easily publish their blog posts as Twitter threads. The feature automatically inserts all the content including text, images, video, and embeds in a WordPress post, into a thread. It also formats the text to fit the right number of words in a Tweet and lets the rest spill to the next one. Users also have an option to format it manually.

Spotify launches widget for iOS and iPadOS 14

Spotify has launched a widget for devices on iOS and iPadOS 14, enabling Apple users to quickly access the music streaming service from their home screens. It’s available with the latest app update in small and medium sizes. The small widget displays the last music played on the app, while the medium widget displays up to five recently played items.

You can read more at thehindu.com/technology",,https://www.thehindu.com/sci-tech/technology/ok6sek/article32879054.ece/ALTERNATES/LANDSCAPE_615/Google,https://www.thehindu.com/sci-tech/technology/weekly-bytes-googles-accessibility-features-oxfords-ml-powered-covid-19-test-and-more/article32879250.ece
5,2020/10/17,"Top news of the day: New Zealand PM Jacinda Ardern wins re-election in a landslide; Chirag Paswan sees a BJP-LJP government in Bihar, and more","The major news headlines of the day, and more.

The mandate means Ms. Ardern, 40, could form the first single-party government in decades, and face the challenge of delivering on the progressive transformation she promised but failed to deliver in her first term, where Labour shared power with a nationalist party.

Bihar Assembly elections | We will see a BJP-LJP government, says Chirag Paswan

In an interview over the phone, LJP president Chirag Paswan speaks to The Hindu about the political turmoil after his father Ram Vilas Paswan’s death and BJP leaders’ comments against him.

Bihar Assembly elections | BJP dares Congress to mention Article 370 restoration in manifesto

Whatever be the issue, the Congress praises Pakistan and China, Union Minister Prakash Javadekar alleged while taking a swipe at Congress leader Rahul Gandhi.

Bihar Assembly elections | Grand Alliance promises jobs to youths, end farm laws

Nitish Kumar government was the first in the country to do away with the APMC (Agriculture Produce Market Committee) Act in 2006, says Congress leader Randeep Singh Surjewala.

The Prime Minister said every step in the logistics, delivery and administration should be put in place rigorously and it must include advanced planning of cold storage chains, distribution network, monitoring mechanism, advance assessment and preparation of ancillary equipment required, such as vails, syringes etc, said a Central government release.

Phase 3 trials of the vaccine are already underway in Russia and UAE.

Of the complaints,1,347 were disposed of. There were 1,152 beyond the Lokpal’s jurisdiction.

The book, called Voice of Millions, was published earlier this year but is yet to be launched formally. What makes the essay more poignant is that Mukherjee was due to address another session of Bangladesh Parliament, this time a Special Session on March 22-23 to mark the Mujibur Rahman centenary, and also to attend the book’s launch. However, the functions in Dhaka were put off due to the coronavirus pandemic.

Mr. Sharif was addressing the first show of strength by the alliance of 11 opposition parties — Pakistan Democratic Movement (PDM) — in Gujranwala, some 80 km from Lahore, late on October 16 via video link from London.

David Beasley told a virtual UN press conference that the global wealth of some 2,200 billionaires rose by about $2 trillion between April and July as the pandemic raged.

Meanwhile, new restrictions went into effect in several other European nations in an effort to staunch the resurgence of the pandemic.

During his tenure, OnePlus has launched several flagships, starting with the OnePlus One in 2014 to the most recent OnePlus 8T.

IPL 2020 | Rampaging Mumbai up against Gayle-inspired Punjab

They have been in rampaging form with five straight wins but Mumbai Indians can ill afford to be complacent against a Chris Gayle-inspired Kings XI Punjab side in their IPL game in Dubai on October 18.

IPL 2020 | KKR aim to sort out batting woes under new captain in clash against SRH

A new captain in the saddle, Kolkata Knight Riders would look to sort out their batting woes and strive for consistency when they face Sunrisers Hyderabad in an intriguing mid-table Indian Premier League clash in Abu Dhabi on October 18.",,https://www.thehindu.com/news/em9k80/article32881651.ece/ALTERNATES/LANDSCAPE_615/APTOPIXNEWZEALANDELECTION,https://www.thehindu.com/news/top-news-of-october-17-2020-new-zealand-pm-jacinda-ardern-wins-re-election-in-a-landslide-chirag-paswan-sees-a-bjp-ljp-government-in-bihar-and-more/article32881652.ece
