,Date,Title,Content,Category,Image_link,Article_link
350,['3/01/2020'],Anuradha Paudwal: Kerala woman claims Bollywood singer Anuradha Paudwal is her mother and demands compensation of Rs 50 crore,"A 45 year old Kerala woman has claimed that Bollywood singer Anuradha Paudwal is her mother and she has filed a petition before the Family District Court to legally establish the same. According to a report on Timesofindia.com, the lady named Karmala Modex informed reporters that her biological parents Arun and Anuradha Paudwal tied the knot in 1972 and she was born in 1974. She further stated that her parents gave her to Ponnachan and Agnes, as they couldn’t raise her due to their hectic schedules.Karmala stated that she was informed about this truth by Ponnachan three years ago when he was on his death bed. Ponnachan and Agnes were family friends of Anuradha Paudwal and raised Karmala as one of their fourth kids. Karmala tried to reach out to Anuradha Paudwal in the past but was denied permission every time.Karmala has reportedly sought compensation of Rs 50 crore from Anuradha and Arun Paudwal , stating that she lost out on a better upbringing because of the decision of her biological parents. She has also claimed a share in ancestral property. Karmala’s advocate M Anil Prasad has reportedly sent a notice to the singer to attend the case hearing scheduled for January 27.",entertainment,"https://static.toiimg.com/thumb/msid-73080632,width-1070,height-580,overlay-toi_sw,pt-32,y_pad-40,resizemode-75,imgsize-548952/73080632.jpg",http://timesofindia.indiatimes.com//entertainment/hindi/music/news/kerala-woman-claims-bollywood-singer-anuradha-paudwal-is-her-mother-and-demands-compensation-of-rs-50-crore/articleshow/73080632.cms
351,['3/01/2020'],Mumbai: Passport office updates MEA on Medha Patkar probe,"This story is from January 3, 2020

Medha Patkar

MUMBAI: The Regional Passport Office, Mumbai, has written to the ministry of external affairs (MEA) providing an update on the status of the inquiry against Narmada Bachao Andolan activist Medha Patkar over allegations that she had not disclosed cases pending against her while applying for a passport.

On December 10, she had surrendered her passport. An official said, “We have not sought permission from MEA for initiating criminal proceedings against her. We just gave an update.”

",mumbai,"https://static.toiimg.com/thumb/msid-73080647,width-1070,height-580,imgsize-372128,resizemode-75,overlay-toi_sw,pt-32,y_pad-40/photo.jpg",http://timesofindia.indiatimes.com//city/mumbai/mumbai-passport-office-updates-mea-on-medha-patkar-probe/articleshow/73080644.cms
352,['3/01/2020'],Santhanam’s Dagaalty to be released this January,"Rhea Chakraborty will be taking action against Sushant Singh Rajput’s family for making false statements before all the investigating authorities and the Supreme Court. Her lawyer Satish Manshinde says, “The prescription and the chats of the two sisters of the actor clearly indicates that the family was aware of the actor's mental health.""",entertainment,"https://static.toiimg.com/thumb/msid-73080626,width-1070,height-580,overlay-toi_sw,pt-32,y_pad-40,resizemode-75,imgsize-984457/73080626.jpg",http://timesofindia.indiatimes.com//entertainment/tamil/movies/news/santhanams-dagaalty-to-be-released-this-january/articleshow/73080626.cms
353,['3/01/2020'],"Sheena Bora murder: No bail on medical grounds, Indrani Mukerjea tries ‘merits’ of case","This story is from January 3, 2020

Indrani Mukerjea

MUMBAI: Sheena Bora murder accused Indrani Mukerjea recently moved a new bail plea after the trial court rejected her fourth application for bail on December 20.

The latest bail plea was the first in which Indrani cited “merits” of the case and said there was no evidence against her. In the four previous pleas, she had sought bail citing ill health.

Mukerjea’s handwritten 10-page plea was submitted last week and is expected to come up for hearing on Friday. Special judge J C Jagdale directed the CBI to submit its reply.

Along with former husbands, Peter Mukerjea and Sanjeev Khanna, Mukerjea is accused of conspiring and murdering her Bora (24) a daughter from a previous relationship, on April 24, 2012.

A fourth accused, Shyamvar Rai, turned approver and deposed as a prosecution witness. Mukerjea has been in jail since her arrest in 2015. So far 59 witnesses have deposed in the case.

Seeking bail, Indrani said that except for Rai’s claim and the prosecution’s allegations, there was no evidence of any content in any messages, emails or conversations or any form of communication to establish that a criminal conspiracy was hatched between the accused to abduct or kill anyone.

She claimed that false witnesses had been planted by the prosecution, details of which she said she would submit during the bail arguments. “Rai’s story does not match the Forensic-Science-Laboratory-certified call data records for the entire month of April 2012,” Indrani’s plea said.

She said different versions were given by Rai before different investigating agencies and courts of how the body was transported from Worli to Pen or how it was burnt. Mukerjea said Rai had a bout of memory loss during cross-examination by the defence. “I cannot remember, I cannot recollect was recorded over 400 times during his deposition in the court,” the plea said.

The plea also focused on the forensic evidence based on the two sets of remains recovered in the case in 2012 and 2015 respectively.

",mumbai,"https://static.toiimg.com/thumb/msid-73080702,width-1070,height-580,imgsize-150761,resizemode-75,overlay-toi_sw,pt-32,y_pad-40/photo.jpg",http://timesofindia.indiatimes.com//city/mumbai/sheena-bora-murder-no-bail-on-medical-grounds-indrani-mukerjea-tries-merits-of-case/articleshow/73080703.cms
354,['3/01/2020'],Watch Video: Tiger Shroff wishes everyone 'a flying start' to the New Year,"After ending 2019 on a high, Tiger Shroff seems adamant to keep the momentum going in the New Year as well. Taking to social media, the young talented actor wished everyone 'a flying start' to 2020.With millions of followers on Instagram itself, Tiger enjoys a huge fan following on various other social media platform as well. Tiger took to Instagram to share a video wherein he can be seen performing a somersault in slow motion before wishing all his fans a happy new year with his team.He captioned the video as ""Wishing everyone a flying start to the year❤️"" The 'Student of the Year 2' was spotted at the airport a few days back with rumoured girlfriend Disha Patani has been busy with his upcoming film ' Baaghi 3 '.While Disha recently joined the cast of the upcoming high octane action flick which also stars Shraddha Kapoor . The two have never come out in the open about their relationship but their public appearances, dinner dates to movie outings and PDA on social media says a lot.'Baaghi 3' which is helmed by Ahmed Khan is currently scheduled to release on 6th March this year. The film will also be featuring Riteish Deshmukh in a pivotal role.",entertainment,"https://static.toiimg.com/thumb/msid-73080698,width-1070,height-580,overlay-toi_sw,pt-32,y_pad-40,resizemode-75,imgsize-190691/73080698.jpg",http://timesofindia.indiatimes.com//entertainment/hindi/bollywood/news/watch-video-tiger-shroff-wishes-everyone-a-flying-start-to-the-new-year/articleshow/73080710.cms
355,['3/01/2020'],803 red industrial units yet to be shifted out of Hyderabad: TSIIC,"This story is from January 3, 2020

Red category units are those industries which have pollution index scores of 60 and above

HYDERABAD: Nearly seven years after a GO was issued to shift polluting industries out of Hyderabad city limits, nothing much has changed on the ground. In all, 803 red category (industries with pollution index score of 60 and above) units and 357 orange category (units with PI score of 41 to 59) industries along the ORR are yet to be shifted out.

This startling revelaton was given by the Telangana State Industrial Infrastructure Corporation Ltd ( TSIIC ) to an RTI query.

Forum for Good Governance (FGG) secretary M Padmanabha Reddy, who filed the RTI, said public health is in grave danger thanks to the polluting units not being shifted out. ""Since 2012-13, there has been very little progress. Red and orange category industries let out untreated effluents which find their way into the Musi, Hussainsagar lake and other water bodies. It involves the health of citizens of Hyderabad,"" he said.

Out of 1,545 industries identified by the Telangana State Pollution Control Board, 385 units exist outside ORR. The remaining 1,160 industries are yet to be shifted. ""The RTI reply says the feasibility study and site suitability has been given to the Environment Protection Training and Research Institute (EPTRI). Once EPTRI completes the feasibility study, shifting of industries will be taken up,"" Reddy said.

As per a GO issued by the industries department in 2013, 45 locations were identified outside ORR limits, which would be notified for industrial use in the HMDA master plan. But, this remained only on paper.

Chief engineer, TSIIC, in his RTI reply, said: ""Steps are being taken to shift edible oil industries to Buchinelly industrial market in Zaheerabad mandal of Sangareddy district and textile industries to Indrakaran industrial park of Sangareddy and steel re-rolling units to Rakamcherla industrial park of Pudur mandal in Vikarabad district for which land has already been developed.""

TSIIC also said that land required for three industrial parks had been identified for relocation and EPTRI was carrying out feasibility studies. ""The environmental assessment committee had recommended environment clearance (EC) for Hyderabad Pharma City in Rangaredy district. Once EC is obtained, we will set in motion the process of shifting pharmaceutical units,"" TSIIC said.

Then government held discussions with representatives of the industry in 2013 when it was decided to identify polluting units in ORR and shift them. The government constituted a committee with commissioner of industries as its chairman. The committee identified pharma, chemical, tannery, bleaching, dying, tobacco, foundry, rubber paints, varnish and pesticide industries to be moved. In March that year, a GO was issued to relocate the polluting industries outside the ORR limits.

",hyderabad,"https://static.toiimg.com/thumb/msid-73080757,width-1070,height-580,imgsize-93681,resizemode-75,overlay-toi_sw,pt-32,y_pad-40/photo.jpg",http://timesofindia.indiatimes.com//city/hyderabad/803-red-industrial-units-yet-to-be-shifted-out-of-hyderabad-tsiic/articleshow/73080725.cms
356,['3/01/2020'],Dhanush starts shooting in Thirunelveli for 'D41',"Actor Dhanush who recently wrapped up the shooting for his film with director Karthik Subbaraj, has begun shooting for his next project tentatively known as ' D41 ' with director Mari Selvaraj . Produced by Kalaipuli Thanu, 'D41' is said to star Malayalam actor Rajisha Vijayan as the female lead.It has been learnt that the shooting of this upcoming film has started in Thirunelveli. Popular Malayalam actor Lal has been roped in to play an important role in the film which is reported to be titled ' Karnan '. Cinematographer turned actor Natarajan Subramanian aka Natty also play a key role in the film. An official confirmation on the title is awaited.Music composer Santhosh Narayanan had begun the song production for the film earlier in November itself. The young musician seems to have recorded with some folk artists from south Tamil Nadu.Meanwhile, Dhanush's Pattas by Durai Senthilkumar will hit the screens on January 16th, 2020.",entertainment,"https://static.toiimg.com/thumb/msid-73080758,width-1070,height-580,overlay-toi_sw,pt-32,y_pad-40,resizemode-75,imgsize-593909/73080758.jpg",http://timesofindia.indiatimes.com//entertainment/tamil/movies/news/dhanush-starts-shooting-in-thirunelveli-for-d41/articleshow/73080758.cms
357,['3/01/2020'],'Vajvuya Band Baja' poster: Amol Kagne unveils the intriguing poster of the film,"Marathi cinema's popular filmmaker, Shivaji Patil's upcoming film 'Vajvuya Band Baja' first look poster has already created a buzz in social media. Now, the makers have unveiled the new poster from the film which is sure to pique your curiosity to watch the film.The poster features a lead star, Sameer Dharmadhikari, Mangesh Desai, Pritam Kagne, and Chinmay Udgirkar in lead roles. The audience will get to see the love story of three brothers, Sandeep (played by Sameer Dharmadhikari ) , Amit (played by Mangesh Desai), and Chinmay Udgirkar in the movie 'Vajvuya Band Baja'. Marathi actress, Pritam Kagne who shimmers and shines in the poster, looks promising in her character.The title coupled against a colourful poster gives a feeling that the film will revolve around a wedding and will be light-hearted or comical in nature. The film is being produced under Amol Kagne and Lakshman Kagne's banners, who have previously produced several hit films like Lathe Joshi, Halal and Perfume.With the release of new poster revealing their lead star cast has already created a lot of curiosity among the fans but they will have to wait a tad longer for the official release date of a trailer from the film. The poster also reveals that the film will release in the wedding season, 20th March 2020.",entertainment,"https://static.toiimg.com/thumb/msid-73080765,width-1070,height-580,overlay-toi_sw,pt-32,y_pad-40,resizemode-75,imgsize-170933/73080765.jpg",http://timesofindia.indiatimes.com//entertainment/marathi/movies/news/vajvuya-band-baja-poster-amol-kagne-unveils-the-intriguing-poster-of-the-film/articleshow/73080765.cms
358,['3/01/2020'],Photo: Deepika Padukone looks bold and beautiful in her bodacious black attire,"Sushant Singh Rajput’s death case is currently being investigated by the Central Bureau Of Investigation (CBI) and they have been questioning a lot of people connected to the late actor. According to the latest report on India Today, three officers who are a part of the probe, have stated that their team has so far not found any evidence that suggests Sushant was murdered on June 14.",entertainment,"https://static.toiimg.com/thumb/msid-73080779,width-1070,height-580,overlay-toi_sw,pt-32,y_pad-40,resizemode-75,imgsize-621263/73080779.jpg",http://timesofindia.indiatimes.com//entertainment/hindi/bollywood/news/photo-deepika-padukone-looks-bold-and-beautiful-in-her-bodacious-black-attire/articleshow/73080779.cms
359,['3/01/2020'],Gentleman trailer to be out on January 6,"Recently, the CBI called Rhea Chakraborty for the third consecutive day on Sunday to question her in the case of her beau Sushant Singh Rajput's death. The 'Jalebi' actress was questioned by the investigation team for nearly seven hours on Saturday. Rhea and her brother reached the DRDO guest house at Kalina in Santacruz, where the probe team is stationed, around 10.30 am, an official said. Now, according to the Times Now report, the CBI team likely to meet Narcotics Control Bureau unit today.",entertainment,"https://static.toiimg.com/thumb/msid-73080684,width-1070,height-580,overlay-toi_sw,pt-32,y_pad-40,resizemode-75,imgsize-74544/73080684.jpg",http://timesofindia.indiatimes.com//entertainment/kannada/movies/news/gentleman-trailer-to-be-out-on-january-6/articleshow/73080684.cms
360,['3/01/2020'],Telangana: 24 doctors to issue Amarnath yatra fitness certificates,"This story is from January 3, 2020

Representational Image

HYDERABAD: The health department has selected a team of 24 specialist doctors to issue compulsory health certificates (CHC) for pilgrims going for Amarnath yatra later this year.

""A list of 24 specialist doctors has been sent by the state health department to Shri Amarnathji Shrine Board already. The 24 doctors from six government hospitals across the state will be issuing certificates free of cost to pilgrims and only certificates issued by the nominated doctors will be valid for taking the pilgrimage,"" said a highly placed source.

Permissions for issuing these certificates have been given to six government hospitals in five districts across the state. These include Gandhi Hospital and Osmania General Hospital in Hyderabad, Mahabunagar Medical College, Nizamabad Government Hospital, Rajiv Gandhi Institute of Medical Sciences Adilabad and Mahatma Gandhi Memorial Hospital in Warangal. Each hospital will have teams of pulmonary, cardiology and Orthopaedic specialists, who will check each pilgrim.

Children below 13 years of age, elderly over 75 years and pregnant women will not be issued fitness certificates as also anyone having health conditions that will make high-altitude treks and extreme weather risky.

",hyderabad,"https://static.toiimg.com/thumb/msid-73080839,width-1070,height-580,imgsize-110860,resizemode-75,overlay-toi_sw,pt-32,y_pad-40/photo.jpg",http://timesofindia.indiatimes.com//city/hyderabad/telangana-24-doctors-to-issue-amarnath-yatra-fitness-certificates/articleshow/73080806.cms
361,['3/01/2020'],Historian of Mumbai seeks archive-museum for it,"This story is from January 3, 2020

Jim Masselos teaches in Sydney

Mumbai should have a museum of its own where an archive of the city comprising private papers, photographs and ephemera could be built, the noted historian of the metropolis Jim Masselos said on Thursday.

Masselos, whose work ‘Towards Nationalism,’ first published in 1974, is well-known for its discussion of the salient aspects of political and public work in western India in the nineteenth century with a focus on Mumbai and Pune, said when he arrived in the city to do research in the 1960s, his work was made easier by three places where he could make a deep dive into archival sources: the library of the University of Mumbai at its Fort campus, which had stuff going back to the early nineteenth century, the Asiatic Society and the government archives.

He said if an archivebuilding museum were set up, it could help preserve private papers — as distinct from business archives — and ephemera, which otherwise finds no place.

Speaking at a function where a book of “essays in honour of Jim Masselos” titled ‘Bombay Before Mumbai’ was discussed, with its editors Prashant Kidambi, Manjiri Kamat and Rachel Dwyer a part of the conversation, Masselos, who teaches at the University of Sydney , described the art and craft of the historian as being akin to a detective story, where “uncertainty” and “discovery” are important and may yield crucial clues.

On Mumbai losing its past, especially the remnants of its one-time working-class culture, he said, “To lose the past is, for any place, sad. No place retains all of its past, but the best must be preserved.” Mumbai varsity professor Manjiri Kamat cited the closure of Anantashram, an eatery in Khotachi Wadi, as an example of the city losing its past.

",mumbai,"https://static.toiimg.com/thumb/msid-73080818,width-1070,height-580,imgsize-363872,resizemode-75,overlay-toi_sw,pt-32,y_pad-40/photo.jpg",http://timesofindia.indiatimes.com//city/mumbai/historian-of-mumbai-seeks-archive-museum-for-it/articleshow/73080810.cms
362,['3/01/2020'],Surgical strike failed to demoralise Pak terrorists: Shiv Sena,"This story is from January 3, 2020

MUMBAI: The Shiv Sena on Friday targeted the Centre by questioning the ""efficacy"" of the 2016 surgical strike and said the perception that it would demoralise Pakistani terrorists remained an ""illusion"" as Indian soldiers continue to get killed in terror attacks in Kashmir.

Accusing the Modi government of boasting about how Pakistan was straightened out after the surgical strike, the Sena sought to know whether it has really happened.

It also observed that troubled borders were not good for the country's well-being.

The Sena's remarks come in the wake of the death of an Army soldier from Maharashtra , Naik Sandip Raghunath Sawant, who was killed during a counter-insurgency operation in Jammu and Kashmir on Wednesday.

""The New Year did not begin on a positive note in Kashmir. Our jawan from Satara, Sandip Sawant, attained martyrdom in Kashmir along with two other soldiers. In the last one month, seven to eight jawans from Maharashtra were killed in the line of duty. The Maha Vikas Aghadi government in Maharashtra is not responsible for this,"" the Sena said in an editorial in party mouthpiece ' Saamana '.

The party also questioned whether the situation in Kashmir has improved after the surgical strike and abrogation of Article 370 provisions.

The party, however, maintained that scrapping Article 370 was a good move.

India had conducted the surgical strike on September 29, 2016, across the Line of Control (LoC) as a response to a terrorist attack on an Indian Army base in Uri sector of Jammu and Kashmir earlier that month.

Without naming the Centre, the Sena alleged, ""Circulating news that only the Pakistanis were getting killed in Kashmir will not change the reality as tricolour-draped bodies of Indian soldiers, like Sawant, are reaching their respective villages.""

""There is a bloodshed along the Kashmir border and mounting anger among the families of martyred jawans. The perception that surgical strike will demoralise Pakistani terrorists has turned out to be an illusion. In fact, the (terror) attacks have increased,"" it added.

The Uddhav Thackeray-led party accused the ruling BJP of boasting about straightening out Pakistan after the surgical strike.

""But has Pakistan been really straightened out? Rather Pakistan has been indulging in ceasefire violations along the LoC every day,"" it added.

The Shiv Sena also questioned the government's claim that the situation in Kashmir was under control after the nullification of Article 370.

""It is good that Article 370 was scrapped. Before that, surgical strike was carried out in Pakistan. But has the situation in Kashmir improved? The terror attacks continue. It's only that there is a control in reporting (these incidents),"" it said.

The Sena also alleged that there was no clarity as to what was transpiring in Kashmir after the scrapping of Article 370 and only the media reports of soldiers sacrificing their lives have been coming out from that state

In a veiled attack on the BJP, its erstwhile ally, the Sena, also accused it of exploiting the surgical strike for political gains.

",india,"https://static.toiimg.com/thumb/msid-73080950,width-1070,height-580,imgsize-223571,resizemode-75,overlay-toi_sw,pt-32,y_pad-40/photo.jpg",http://timesofindia.indiatimes.com//india/surgical-strike-failed-to-demoralise-pak-terrorists-shiv-sena/articleshow/73080627.cms
363,['3/01/2020'],"No one called ex-J&amp;K CMs 'anti-national', decision on their release by UT admin: Amit Shah","This story is from January 3, 2020

NEW DELHI: No one in the government has ever called the three detained former chief ministers of the erstwhile state of Jammu and Kashmir ""anti-national"", home minister Amit Shah has said, adding that a decision on their release will be taken by the administration of the union territory.

Farooq Abdullah, Omar Abdullah and Mehbooba Mufti had to be detained for ""some time"" after they made provocative statements, the home minister said on Thursday night while addressing an event organised by media outlet ABP News.

""Please see the statements made by them, like the entire country will be on fire if Article 370 was touched... In the backdrop of these statements, a professional decision was taken to keep them under detention for sometime,"" Shah said at the news summit.

Many political leaders in Jammu and Kashmir, including the three former chief ministers, were detained on August 5, the day the Centre announced abrogation of Article 370 provisions and bifurcation of the state into the union territories of Jammu and Kashmir, and Ladakh.

While Farooq Abdullah has been booked under the stringent Public Safety Act and confined to his Gupkar Road residence in Srinagar, which has been declared a sub-jail, his son Omar Abdullah has been detained at Hari Niwas. PDP chief Mufti was lodged at Chesmashahi hut initially but later shifted to a government accommodation.

To a question pointing out that Abdullahs' National Conference and Mufti's PDP were alliance partners of the BJP at some point of time and the leaders were now being labelled ""anti-national"", the home minister made it clear that neither he nor anyone from the government had called them so.

""As far as the decision to release them is concerned, this decision will be taken by the local administration and not me,"" he said, adding that the administration will release them whenever it deems suitable.

Shah said the situation in the Kashmir Valley was under control and day-to-day life was going on smoothly.

""Not a single inch in Kashmir is under curfew today,"" he added.

",india,"https://static.toiimg.com/thumb/msid-73080854,width-1070,height-580,imgsize-63274,resizemode-75,overlay-toi_sw,pt-32,y_pad-40/photo.jpg",http://timesofindia.indiatimes.com//india/no-one-called-ex-jk-cms-anti-national-decision-on-their-release-by-ut-admin-amit-shah/articleshow/73080861.cms
