,Date,Title,Content,Category,Image_link,Article_link
227,['3/01/2020'],Full cream milk vs toned milk: Which one is better?,"We all have grown up hearing that a glass full of milk can suffice the body’s nutritional requirement. There’s nothing better than a glass full of milk as it has ample nutrition to satiate the body’s daily dose of good health. But for most of us it is confusing to decide -- which is better-- toned milk or full cream milk. After losing weight is always a priority!Since ages, we have been reading and hearing a lot about milk and it’s amazing health benefits, but despite all good things many people find it difficult to digest this healthy drink. This is usually due to lactose-intolerance, which makes it difficult for people suffering from it to lose weight and digest milk. If you too find it confusing to decide which type of milk is good for you then keep reading.Enriched with the goodness of calcium , milk has always been associated with healthy bones and healthy teeth. Milk is one of the healthiest drinks, but if you are planning to lose weight then going for the low-fat variant of milk is often advised by experts. Since ages, we have been drinking cow milk also known as full cream milk, but is it good for someone trying to lose weight or someone suffering from lactose intolerance. However, there are so many varieties of milk which makes it a perfect drink to stay healthy and lose weight. One of the most popular variants of milk is a toned milk and it is believed to be a much healthier variant in terms of losing weight.No wonder losing weight is a universal desire, but the efforts needed can seem daunting sometimes. Hence, the best way to embark on a weight loss journey is by tweaking the way we eat or drink. In fact, healthy choices can set the tone right for losing weight. So, if you want to lose weight in a sustained way then selecting the right variant becomes a challenge read on to find out what is better toned milk or full-cream milk.One of the most popular milk variant- toned milk is prepared by adding skimmed milk powder and water to whole milk. This process helps in cutting down the fat content of milk. Moreover, it also increases its quantity as well as quality. Technically, it is the same thing as skimmed milk. In fact, one glass of toned milk contains around 80 calories, which is as good as half-the calorie count of full-cream milk.",life-style,"https://static.toiimg.com/thumb/msid-73072387,width-1070,height-580,overlay-toi_sw,pt-32,y_pad-40,resizemode-75,imgsize-167098/73072387.jpg",http://timesofindia.indiatimes.com//life-style/food-news/which-is-better-full-cream-milk-or-toned-milk/articleshow/73072387.cms
228,['3/01/2020'],Mumbai Robbery: Mumbai businessman held for robbing forex delivery boy,"This story is from January 3, 2020

Representative image

The Hyderabad police have arrested a Mumbai businessman on charges of robbing $7,500 from the delivery boy of a foreign exchange firm at Kalyaninagar on November 21 after placing an order for forex over the phone.

The businessman, Rahul Kiran Gatiya, was arrested from his Mumbai residence on December 28. Inspector Ajay Waghmare of Yerawada police told TOI, “During questioning, Gatiya confessed to the Hyderabad police he had committed similar robberies in Mumbai, Pune, Bengaluru and Hyderabad.”

“The Hyderabad police have recovered Rs7.50lakh from his possession,” he said.

Investigations have revealed Gatiya faced losses in his business, following which he took to crime.

",mumbai,"https://static.toiimg.com/thumb/msid-73079001,width-1070,height-580,imgsize-76973,resizemode-75,overlay-toi_sw,pt-32,y_pad-40/photo.jpg",http://timesofindia.indiatimes.com//city/mumbai/mumbai-businessman-held-for-robbing-forex-delivery-boy/articleshow/73079004.cms
229,['3/01/2020'],Mumbai Robbery: Mumbai businessman held for robbing forex delivery boy,"This story is from January 3, 2020

Representative image

The Hyderabad police have arrested a Mumbai businessman on charges of robbing $7,500 from the delivery boy of a foreign exchange firm at Kalyaninagar on November 21 after placing an order for forex over the phone.

The businessman, Rahul Kiran Gatiya, was arrested from his Mumbai residence on December 28. Inspector Ajay Waghmare of Yerawada police told TOI, “During questioning, Gatiya confessed to the Hyderabad police he had committed similar robberies in Mumbai, Pune, Bengaluru and Hyderabad.”

“The Hyderabad police have recovered Rs7.50lakh from his possession,” he said.

Investigations have revealed Gatiya faced losses in his business, following which he took to crime.

",hyderabad,"https://static.toiimg.com/thumb/msid-73079001,width-1070,height-580,imgsize-76973,resizemode-75,overlay-toi_sw,pt-32,y_pad-40/photo.jpg",http://timesofindia.indiatimes.com//city/hyderabad/mumbai-businessman-held-for-robbing-forex-delivery-boy/articleshow/73079006.cms
230,['3/01/2020'],Kerala: Man attacked for refusing CPM leader money for bash,"This story is from January 3, 2020

Jackfruit vendor Senthil Roy (in picture) was hospitalized after the attack by secretary of CPM’s Naduthottam ... Read More

THIRUVANANTHAPURAM: A local CPM leader at Parassala was arrested by police on Thursday on charges of attempt to murder for allegedly subjecting a man to brutal assault for questioning extortion.

Pradeep, 29, of Naduthottam under Parassala police station limits is the secretary of CPM's Naduthottam branch. The complainant, Senthil Roy alias Reji, 39, of Valanvila near Injivila under Parassala police station limits is being treated at Thiruvananthapuram Government Medical College Hospital. Roy, a jackfruit vendor, has sustained five broken ribs, a fracture on skull and injuries on lungs, police said.

Parassala police station house officer inspector S M Riyaz said as per the statement of the complainant, he was assaulted by a group of men, including Pradeep, during the early hours of January 1 at Valanvila after he refused to give them money for buying beverages for New Year celebrations. They kicked him down and ran an autorickshaw over his body, inflicting serious injuries on his ribcage.

""The complainant mentioned four people whom he could identify and three men, whom he could not identify. Pradeep was one among those identified. Hence, we took him into custody and recorded his arrest. A search is on for the remaining assailants,'' the inspector said.

Though the alleged attack took place around 1am on Wednesday, police received the information only by the evening. On the same night, they visited the complainant at the hospital and recorded his statement following which a case was registered. On Thursday, around 11am, they detained Pradeep and simultaneously made arrangements to record the sworn statement of the complainant by a local magistrate under provisions of section 164 of CrPC owing to the serious nature of the case as the accused was a local leader of the ruling party. They also moved Pradeep to a secret location anticipating protests from his party workers.

Meanwhile, the CPM local leadership of Parassala cried foul over the arrest of Pradeep. Speaking to TOI, CPM Parassala local committee secretary R Biju said Pradeep was not even there at the crime scene when it occurred. ""Pradeep has been on the forefront of activities related to curbing substance mafia in the locality. The people who attacked Roy are members of substance mafia. There are people, including elderly persons returning from church, who witnessed the attack. According to them, it was just two men who assaulted Roy, and Pradeep was not there,'' Biju said.

",kochi,"https://static.toiimg.com/thumb/msid-73079051,width-1070,height-580,imgsize-214949,resizemode-75,overlay-toi_sw,pt-32,y_pad-40/photo.jpg",http://timesofindia.indiatimes.com//city/kochi/kerala-man-attacked-for-refusing-cpm-leader-money-for-bash/articleshow/73079063.cms
231,['3/01/2020'],Kerala: Man attacked for refusing CPM leader money for bash,"This story is from January 3, 2020

Jackfruit vendor Senthil Roy (in picture) was hospitalized after the attack by secretary of CPM’s Naduthottam ... Read More

THIRUVANANTHAPURAM: A local CPM leader at Parassala was arrested by police on Thursday on charges of attempt to murder for allegedly subjecting a man to brutal assault for questioning extortion.

Pradeep, 29, of Naduthottam under Parassala police station limits is the secretary of CPM's Naduthottam branch. The complainant, Senthil Roy alias Reji, 39, of Valanvila near Injivila under Parassala police station limits is being treated at Thiruvananthapuram Government Medical College Hospital. Roy, a jackfruit vendor, has sustained five broken ribs, a fracture on skull and injuries on lungs, police said.

Parassala police station house officer inspector S M Riyaz said as per the statement of the complainant, he was assaulted by a group of men, including Pradeep, during the early hours of January 1 at Valanvila after he refused to give them money for buying beverages for New Year celebrations. They kicked him down and ran an autorickshaw over his body, inflicting serious injuries on his ribcage.

""The complainant mentioned four people whom he could identify and three men, whom he could not identify. Pradeep was one among those identified. Hence, we took him into custody and recorded his arrest. A search is on for the remaining assailants,'' the inspector said.

Though the alleged attack took place around 1am on Wednesday, police received the information only by the evening. On the same night, they visited the complainant at the hospital and recorded his statement following which a case was registered. On Thursday, around 11am, they detained Pradeep and simultaneously made arrangements to record the sworn statement of the complainant by a local magistrate under provisions of section 164 of CrPC owing to the serious nature of the case as the accused was a local leader of the ruling party. They also moved Pradeep to a secret location anticipating protests from his party workers.

Meanwhile, the CPM local leadership of Parassala cried foul over the arrest of Pradeep. Speaking to TOI, CPM Parassala local committee secretary R Biju said Pradeep was not even there at the crime scene when it occurred. ""Pradeep has been on the forefront of activities related to curbing substance mafia in the locality. The people who attacked Roy are members of substance mafia. There are people, including elderly persons returning from church, who witnessed the attack. According to them, it was just two men who assaulted Roy, and Pradeep was not there,'' Biju said.

",kozhikode,"https://static.toiimg.com/thumb/msid-73079051,width-1070,height-580,imgsize-214949,resizemode-75,overlay-toi_sw,pt-32,y_pad-40/photo.jpg",http://timesofindia.indiatimes.com//city/kozhikode/kerala-man-attacked-for-refusing-cpm-leader-money-for-bash/articleshow/73079062.cms
232,['3/01/2020'],Kerala: Man attacked for refusing CPM leader money for bash,"This story is from January 3, 2020

Jackfruit vendor Senthil Roy (in picture) was hospitalized after the attack by secretary of CPM’s Naduthottam ... Read More

THIRUVANANTHAPURAM: A local CPM leader at Parassala was arrested by police on Thursday on charges of attempt to murder for allegedly subjecting a man to brutal assault for questioning extortion.

Pradeep, 29, of Naduthottam under Parassala police station limits is the secretary of CPM's Naduthottam branch. The complainant, Senthil Roy alias Reji, 39, of Valanvila near Injivila under Parassala police station limits is being treated at Thiruvananthapuram Government Medical College Hospital. Roy, a jackfruit vendor, has sustained five broken ribs, a fracture on skull and injuries on lungs, police said.

Parassala police station house officer inspector S M Riyaz said as per the statement of the complainant, he was assaulted by a group of men, including Pradeep, during the early hours of January 1 at Valanvila after he refused to give them money for buying beverages for New Year celebrations. They kicked him down and ran an autorickshaw over his body, inflicting serious injuries on his ribcage.

""The complainant mentioned four people whom he could identify and three men, whom he could not identify. Pradeep was one among those identified. Hence, we took him into custody and recorded his arrest. A search is on for the remaining assailants,'' the inspector said.

Though the alleged attack took place around 1am on Wednesday, police received the information only by the evening. On the same night, they visited the complainant at the hospital and recorded his statement following which a case was registered. On Thursday, around 11am, they detained Pradeep and simultaneously made arrangements to record the sworn statement of the complainant by a local magistrate under provisions of section 164 of CrPC owing to the serious nature of the case as the accused was a local leader of the ruling party. They also moved Pradeep to a secret location anticipating protests from his party workers.

Meanwhile, the CPM local leadership of Parassala cried foul over the arrest of Pradeep. Speaking to TOI, CPM Parassala local committee secretary R Biju said Pradeep was not even there at the crime scene when it occurred. ""Pradeep has been on the forefront of activities related to curbing substance mafia in the locality. The people who attacked Roy are members of substance mafia. There are people, including elderly persons returning from church, who witnessed the attack. According to them, it was just two men who assaulted Roy, and Pradeep was not there,'' Biju said.

",thiruvananthapuram,"https://static.toiimg.com/thumb/msid-73079051,width-1070,height-580,imgsize-214949,resizemode-75,overlay-toi_sw,pt-32,y_pad-40/photo.jpg",http://timesofindia.indiatimes.com//city/thiruvananthapuram/kerala-man-attacked-for-refusing-cpm-leader-money-for-bash/articleshow/73079013.cms
233,['3/01/2020'],"Bigg Boss Kannada 7 written update: Bigg Boss Kannada 7 update, Day 81: Shine Shetty gains maximum luxury points","In the latest episode of Bigg Boss Kannada 7 , Bigg Boss announces the next stage of the luxury budget task, in which the contestants are provided with stocking and an egg.The contestants are asked to break the egg placed on their opponent's head with the help of a baton made of foam. While some choose to stand alone, others team-up for an attack.Bhoomi manages to protect the egg and gains 400 points. Prathap earns 200 points and bags the second spot.After a while, Bigg Boss assigns a task to Shine Shetty as he hits the buzzer first. As per the task, Shine is asked to pick nicknames for his inmates according to their characteristics and behaviour inside the house.By the end of the task, Shine gains 100 points.Later, Bigg Boss announces the next task for the day. As per the task, the contestants are asked to grab a balloon from one end and tag it to a pole at the other end of the garden area. To tag the balloon, the contestants are asked to pass a frame, which consists of tangled ropes.The housemates gear up for the task. As the task progresses, Deepika, Kishen, Bhoomi and Prathap team up and decide to blast the balloons of the other contestants.However, Shine manages to overcome all the obstacles and tags four balloons. He gains 400 points.Since Deepika and Prathap managed to tag three balloons each, Bigg Boss announces a tiebreaker between them.As the duo gear up for the task, the inmates cheer for them. Prathap completes the task first and bags the second spot.After the task, Chandana suffers a breakdown due to embarrassment as she failed to perform in the task related to balloons. Shine and Bhoomi console her.",tv,"https://static.toiimg.com/thumb/msid-73079014,width-1070,height-580,overlay-toi_sw,pt-32,y_pad-40,resizemode-75,imgsize-175609/73079014.jpg",http://timesofindia.indiatimes.com//tv/news/kannada/bigg-boss-kannada-7-update-day-81-shine-shetty-gains-maximum-luxury-points/articleshow/73079003.cms
234,['3/01/2020'],Cops act after clip of moral policing at fort in Kajrat goes viral,"This story is from January 3, 2020

Representative image

NAVI MUMBAI: After a video of a group of 11 youths being harassed by another group and accused of consuming alcohol and drugs during New Year celebrations in the Peb fort area of Karjat went viral, the police initiated action on Thursday.

The police are yet to ascertain how many people assaulted the youths and made them remove their shirts on New Year’s Eve.

The victims included a Chhattisgarh resident, while the rest were from Mumbai.

The victims were stripped, assaulted, made to kneel down and forced to promise not to repeat what they were doing.

The group that did the moral policing filmed the incident and posted the video on social media.

“After the video went viral on social media, our officials had a discussion on the issue with Raigad SP Anil Paraskar,” assistant inspector Avinash Patil said. “Based on his instructions, the details were found out and a suo motu police case has been registered for wrongful restraint (IPC 341) against unknown persons on Thursday.”

Patil said that after recording the statement of the victims additional sections would be invoked and a manhunt launched for the suspects.

“As nobody goes to the fort at the year-end, our teams were not patrolling the area,” he said. “One of the victims was supposed to come to the police station but was not able to do it due to some family issues.”

Locals say there are many organisations, many of them with very similar names, that are into moral policing there. The number of people involved in the harassment would be known after the victims come forward and give details of the incident. One of the accused is partly visible in the video but is yet to be identified.

",navi-mumbai,"https://static.toiimg.com/thumb/msid-73079053,width-1070,height-580,imgsize-139748,resizemode-75,overlay-toi_sw,pt-32,y_pad-40/photo.jpg",http://timesofindia.indiatimes.com//city/navi-mumbai/cops-act-after-clip-of-moral-policing-at-fort-in-kajrat-goes-viral/articleshow/73079056.cms
235,['3/01/2020'],"Trichy: Class 11 girl, missing for two days, found dead","This story is from January 3, 2020

Representative image

TRICHY: A 16-year-old girl, who went missing from home a couple of days ago, was found dead with her face wrapped at North Nagamangalam near Manikandam in Trichy on Thursday.

Acting on the information from local people, the Manikandam police rushed to the spot and found the girl’s body under the bushes. The police said that her face was covered with her dupatta. The hands and legs were not tied. The police recovered the body and brought it to Mahatma Gandhi memorial government hospital (MGMGH) in Trichy.

The preliminary enquiry revealed that she was a Class 11 student residing in the area. Her parents had lodged a complaint with the Manikandam police after the girl reportedly went missing from home at 8.30 pm on December 31.

The police said that the parents of the girl said to the police that she went out to relieve herself on the day but she failed to return home. The police said that there were no external injuries on her body.

",trichy,"https://static.toiimg.com/thumb/msid-73079043,width-1070,height-580,imgsize-162139,resizemode-75,overlay-toi_sw,pt-32,y_pad-40/photo.jpg",http://timesofindia.indiatimes.com//city/trichy/trichy-class-11-girl-missing-for-two-days-found-dead/articleshow/73079049.cms
236,['3/01/2020'],Mikel Arteta appointment has changed Arsenal,"This story is from January 3, 2020

Mikel Arteta. (Reuters Photo)",sports,"https://static.toiimg.com/thumb/msid-73079101,width-1070,height-580,imgsize-138958,resizemode-75,overlay-toi_sw,pt-32,y_pad-40/photo.jpg",http://timesofindia.indiatimes.com//sports/football/epl/top-stories/mikel-arteta-appointment-has-changed-arsenal/articleshow/73079102.cms
237,['3/01/2020'],20 foot-tall purifier to keep the air clean at Lajpat Nagar market,"This story is from January 3, 2020

The tower will be inaugurated by Gautam Gambhir on Friday.

NEW DELHI: In a first-of-its-kind initiative, the Traders’ Association Lajpat Nagar (TALN), in coordination with east Delhi area MP Gautam Gambhir , has decided to install a 20-foot-tall prototype air purifier in Central Market.

The tower will be inaugurated by Gambhir on Friday.

Ashwani Marwah, general secretary of the association, said that the tower will purify air within a circumference area of 500-750 metres.

“We were working on this for long. It could be realised only after we got permission from various authorities, including South Corporation, to install the tower over a covered drain. Our area MP’s foundation agreed to support the cost of equipment. We will bear the running cost,” he said.

“It may also curb foul smell emanating from the main drain in Lajpat Nagar,” he added.

Gambhir said that the tower is expected to treat up to 6,00,000 cubic metres of air per day and collect more than 75% of two kinds of pollutants i.e. PM 2.5 and PM 10.

“Fighting Delhi’s pollution is my priority and we are working on several such initiatives. We will analyse this outdoor purifier’s performance and then install several such purifiers across the constituency,” the MP added.

",delhi,"https://static.toiimg.com/thumb/msid-73079100,width-1070,height-580,imgsize-452512,resizemode-75,overlay-toi_sw,pt-32,y_pad-40/photo.jpg",http://timesofindia.indiatimes.com//city/delhi/20-foot-tall-purifier-to-keep-the-air-clean-at-lajpat-nagar-market/articleshow/73079094.cms
238,['3/01/2020'],"Finance ministry pushes banks, businesses to put in RuPay infra","This story is from January 3, 2020

(Representative image)

NEW DELHI: With a large number of banks only issuing Mastercard or Visa cards, the finance ministry has decided to ask them to ensure that there is no infrastructure or card constraint that holds back consumers from taking advantage of the benefit of no merchant discount rate on RuPay or UPI.

Similarly, the revenue department is meeting industry bodies to spread the message that all businesses with annual turnover of Rs 50 crore or more put in place the required infrastructure for the smooth rollout of the regime that was announced in the Budget. “Anyone who does not allow consumers to take advantage of this scheme will face a daily penalty of Rs 5,000. We want to ensure that the rollout is smooth,” a senior officer told TOI.

The sources said that tax officials will visit stores from February 1 to check if the facility is available or not and anyone found to be violating the diktat will be fined.

The move is part of the government’s push to promote digital transactions, which not only help track fund flow easily but also reduce the cost of business. Tax officials said that banks should be encouraging the use of cashless transactions instead of hobbling them. The revenue department stepped in to announce the measures that banks were seen to be moving slowly in the absence of RBI guidelines.

“Banks can’t be seen to be promoting one or the other payment system, they need to provide RuPay and UPI,” said an officer. The MDR waiver for businesses with annual turnover of Rs 50 crore or more is effective from Wednesday. MDR is the cost paid by a merchant to a bank for accepting payment from their customers via digital means.

",business,"https://static.toiimg.com/thumb/msid-73079108,width-1070,height-580,imgsize-70922,resizemode-75,overlay-toi_sw,pt-32,y_pad-40/photo.jpg",http://timesofindia.indiatimes.com//business/india-business/finance-ministry-pushes-banks-businesses-to-put-in-rupay-infra/articleshow/73079111.cms
239,['3/01/2020'],Maharashtra: Employee of ATM security firm decamps with Rs 4 crore,"This story is from January 3, 2020

Representative image

NAVI MUMBAI: The Koparkhairane police are on the lookout for an employee of a security firm, which handles cash for several bank ATMs, for allegedly decamping with Rs 3.96 crore cash meant for 35 ATMs in Thane, Bhiwandi and Palghar.

Senior inspector Suryakant Jagdale said accused Sachin Wagh (35) is a resident of Kalwa, Thane and had been working for Securitrans India Pvt Ltd (SIPL) for the past 12 years as senior custodian of the cash to be deposited in ATMs. “He had the keys and passwords of 37 ATMs in Thane, Bhiwandi and Palghar areas and he allegedly misused this information to commit the crime,” the police officer said.

Jagdale said the embezzlement came to light after Wagh did not report to work on December 26. When Wagh was not reachable on his cellphone, staff members went to his house. They were told he had left for office at 6 am.

“An audit of route number 2 assigned to Wagh revealed he had loaded only partial cash in 35 ATMs and swindled the rest between December 11 and December 13,” Jagdale said.As the agency has alleged some bank staff might also be involved in the crime, an FIR has been registered against Wagh and others.

",navi-mumbai,"https://static.toiimg.com/thumb/msid-73079117,width-1070,height-580,imgsize-110726,resizemode-75,overlay-toi_sw,pt-32,y_pad-40/photo.jpg",http://timesofindia.indiatimes.com//city/navi-mumbai/maharashtra-employee-of-atm-security-firm-decamps-with-rs-4-crore/articleshow/73079121.cms
