,Date,Title,Content,Category,Image_link,Article_link
120,['3/01/2020'],"To boost artificial intelligence adoption, Telangana pairs industry, academia","This story is from January 3, 2020

Minister KT Rama Rao inaugrates Telangana's Year of AI in the city on Thursday. (Left) IT secretary Jayesh Ran... Read More

HYDERABAD: The Telangana government on Thursday declared 2020 as the year of artificial intelligence (AI) and inked nine memoranda of understanding (MoUs) with IT players and educational institutions to develop various use cases as well as conduct research on the application of AI and creation of talent pool in this area.

Intel, Public Health Foundation of India (PHFI) and IIIT- Hyderabad jointly inked a pact with the government for setting up a research centre in applied AI in healthcare and mobility.

Speaking at the event, Nivruti Rai, country head, Intel India, said, “AI is going to make a $13 trillion addition to the world economy, if you think AI, there are five characteristics of data that are essential to drive its success – quality, quantity, depth, access and diversity and India has it all.” She said Intel will be working with IIIT-Hyderabad, PHFI and state government to leverage AI to broaden the access of quality healthcare to masses.

The state also inked a pact with Nvidia that will be setting up a high performance computing AI centre in Hyderabad. The government entered into a MoU with IIT-Kharagpur to set up an AI centre of excellence and research and development park in the city. Telangana will also be partnering with Adobe, IIT Hyderabad for capacity building in AI.

“As we all know, machine readable data is the core of any AI/ML algorithm. Realizing that availability of quality data would be a key differentiator, we had launched the open data policy and published data related to about 20 departments on the open data platform... The aim, going forward, is to democratise seamless availability of data by creating population scale curated public data sets, especially in the areas of mobility, healthcare, agriculture and e-governance, leading to better innovation, governance and successful business outcomes,” Telangana IT minister KT Rama Rao said, adding that Telangana would create India AI Data Trust that would be a resource centre of such data sets.

He also added the state would work with partners to make available a high-performance AI Computing (HPAIC) infrastructure for startups and research centers.

",hyderabad,"https://static.toiimg.com/thumb/msid-73077629,width-1070,height-580,imgsize-560250,resizemode-75,overlay-toi_sw,pt-32,y_pad-40/photo.jpg",http://timesofindia.indiatimes.com//city/hyderabad/to-boost-artificial-intelligence-adoption-telangana-pairs-industry-academia/articleshow/73077630.cms
121,['3/01/2020'],Why so serious? Here are 12 pictures of Aryan Khan not smiling for the camera,"Kangana Ranaut fans were in for a surprise on August 21 as the actress announced her arrival on Twitter. And within 10 days of her debut on the micro-blogging site, Kangana has clocked 1 million followers. In an exclusive interaction with ETimes, Kangana Ranaut opened up about her tryst with social media, how she deals with trolls and all things Twitter. Excerpts from the interview:",entertainment,"https://static.toiimg.com/thumb/msid-73077642,width-1070,height-580,overlay-toi_sw,pt-32,y_pad-40,resizemode-75,imgsize-353411/73077642.jpg",http://timesofindia.indiatimes.com//entertainment/hindi/bollywood/news/why-so-serious-here-are-12-pictures-of-aryan-khan-not-smiling-for-the-camera/articleshow/73077550.cms
122,['3/01/2020'],NGO survey reveals rising burden of diseases in Hyderabad,"Representative image

HYDERABAD: Non-communicable diseases like diabetes, hypertension, cardiovascular problems, cancer, and kidney ailments take a heavy toll on the health profile of the residents living in old city of Hyderabad. A health survey by an NGO in areas south of the river Musi has revealed that about 12% of the adults have diabetes and about 20% have reported hypertension while 5% suffer from heart diseases.The NGO, Helping Hand Foundation (HHF), in its survey report released on Thursday said the incidence of cancer is increasing in the city. About one-third of the cancer cases in Telangana are from Hyderabad. The cancer of head and neck, particularly oral cancer in men, breast cancer in women and blood cancer in children below 5 years is causing concern, the report said.“Pulmonary and extrapulmonary TB is also alarmingly high in teenage population of old city. An estimated 600 to 700 new cases of TB are reported every month,” the report said, adding that one in three families with one or more members with noncommunicable diseases are under the burden of loans or are in debt due to borrowing money to meet medical expenses.Helping Hand Foundation managing trustee Mujtaba Hasan Askari said about 25% of households in old city slums suffer from chronic illnesses. Many students of higher education are forced to discontinue studies to take up menial jobs to support the families.He said about 13,000 patients from poor sections of society were provided medical help during 2019 in government hospitals. Patients were encouraged to approach government hospitals, and this had helped the poor families save about ₹7 crore during the year.The rising burden of noncommunicable diseases is putting a huge amount of mental and financial stress on the common man from the city and by linking them to the public health system a great amount of justice is being done, Mujtaba Hasan added.As part of the survey, HHF volunteers visited houses and hospitals in the city, particularly in old city, to collect data about various health issues vis-à-vis the financial burden the families are subjected to due to non-communicable diseases. Several health checkup camps were set up and data collected during such exercises were computed to arrive at the burden of disease in old city and other parts of Hyderabad.",hyderabad,"https://static.toiimg.com/thumb/msid-73077657,width-1070,height-580,imgsize-324908,resizemode-75,overlay-toi_sw,pt-32,y_pad-40/photo.jpg",http://timesofindia.indiatimes.com//city/hyderabad/ngo-survey-reveals-rising-burden-of-diseases-in-hyderabad/articleshow/73077658.cms
123,['3/01/2020'],"CAA Protest Chennai: Organiser, NGO hit back at top cop","This story is from January 3, 2020

File photo of a woman drawing kolam on road

CHENNAI: Anti-corruption NGO Arappor Iyakkam on Thursday condemned Chennai police commissioner A K Vishwanathan for referring to the NGO while talking about kolam protests. The NGO alleged that it was purposefully done to somehow connect it with Pakistan and tarnish its image among the public.

During a press meet on Wednesday, Vishwanathan alleged that one protester, Gayatri Khandhadai, was being probed for her ‘Pakistani links’ based on her social media activity. He alleged that she was in touch with groups such as Popular Front of India (PFI) and Arappor Iyakkam.

“This is part of a witchhunt launched against Arappor and its office-bearers for our continued expose about corruption in Greater Chennai Corporation . Vishwanathan has misused the police force to file a series of false FIRs against us,” Jayaram Venkatesan, convenor of Arappor Iyakkam, said. Indoor meetings of the NGO have been stopped and hall owners have been asked not to give space, Arappor said.

Vishwanathan told TOI that several FIRs had been filed against Arappor Iyakkam and its office-bearers. “They are facing trial in these cases. They have raised false allegations in the past and these allegations are also false,” he said.

Arappor questioned why Vishwanathan did not name principal opposition party DMK while speaking about parties that condemned Chennai police’s arrest of kolam protestors. “Is it because he will lose his chance of becoming DGP if DMK comes to power in 2021,” the statement said.

Arappor said last June, Vishwanathan asked Jayaram to meet local bodies minister S P Velumani to sort out issues and that the commissioner was under pressure from the minister to deny permission to Arappor’s events.

",chennai,"https://static.toiimg.com/thumb/msid-73077660,width-1070,height-580,imgsize-584902,resizemode-75,overlay-toi_sw,pt-32,y_pad-40/photo.jpg",http://timesofindia.indiatimes.com//city/chennai/kolam-stir-organiser-ngo-hit-back-at-top-cop/articleshow/73077645.cms
124,['3/01/2020'],"Govt eyes Rs 30,000 crore via cash management bill","This story is from January 3, 2020

File photo

MUMBAI: Faced with redemptions of government securities (G-Secs) aggregating Rs 1.35 lakh crore till January 16, the government on Thursday said it will auction cash management bills (CMBs) on Monday to mop up Rs 30,000 crore. This is the second CMB in the last two weeks. The government usually issues CMBs to tide over situations of temporary liquidity mismatch.

RBI data shows that on Thursday the government had a redemption worth Rs 61,000 crore, while another worth Rs 74,000 crore is due on January 16. To meet this large demand for liquidity, the government is auctioning CMBs, bond dealers said. On December 31, the government had mobilised Rs 30,000 crore through CMBs of 76-day tenure. The CMBs that will be auctioned on Monday will have a tenure of 70 days, the RBI release showed.

During the day, the central bank also announced its third ‘operation twist’, a move in which the government’s banker will buy G-Secs of long and medium tenure worth Rs 10,000 crore and at the same time sell government bonds of less than one year tenure. This is the third such operation by the RBI in as many weeks, aimed at pulling down the 10-year benchmark yield, which is one of the main determinants of the lending rates by banks.

Since February this year, the RBI has cut interest rate five times, by a total of 135 basis points (100 basis points = 1 percentage point). However, just before the first operation twist was announced on December 19, the aggregate decline in yield on the 10-year G-Sec was 80bps — from 7.55% in early-February to 6.75% on that day. Even after two such operations by the RBI, the benchmark yield on 10-year G-Secs on Thursday closed at 6.51%, translating to a decline of 24bps in the last three weeks.

",business,"https://static.toiimg.com/thumb/msid-73077664,width-1070,height-580,imgsize-1007858,resizemode-75,overlay-toi_sw,pt-32,y_pad-40/photo.jpg",http://timesofindia.indiatimes.com//business/india-business/govt-eyes-rs-30000-crore-via-cash-management-bill/articleshow/73077665.cms
125,['3/01/2020'],Central metro station to get parking space in two weeks,"This story is from January 3, 2020

File photo of a Chennai Metro train

CHENNAI: It has been nearly a year since the city’s largest underground interchange metro station at Central opened for service, but commuters are still struggling to find space to park their vehicles as the planned parking lot is yet to be opened. But according to CMRL, there will soon be some relief, as an underground parking space is expected to open by mid-January. The lot will be able to hold 100 cars and 300 two-wheelers at a time.

“We are fixing glass panes at the entrance of the parking lot. It will be ready in another 15 days,” an official said. Central metro became operational in February 2019 when the last leg of the 45km phase-1 from Washermenpet to AG-DMS via Central metro was thrown open to public.

Till now, metro rail commuters at Central struggle to find parking space and end up leaving their vehicles either at Central railway station or near the Ripon Buildings. The hassle of finding space is even worse for those arriving at the station for the first time, since they are not aware that the parking lot is not ready. “It was my first time at the metro and I went around the junction in front of Central station thrice looking for parking space, until a CMRL staff told me the parking lot is not open. It was a struggle as it was peak hour traffic,” said S Harish of Vepery.

The parking lot under construction is on the concourse level of Central metro and is linked to the entrance through a ramp. Once opened, officials said it can be used both by metro rail commuters as well as others. Passengers taking suburban trains at Moore Market Complex or outstation trains at Central Railway Station too could use the facility, as the parking lot is closer to these transport hubs. Passengers to Park and Park Town stations could also use the facility as it is only a pedestrian subway away.

Several other stations along the two corridors of phase-1do not have parking space.

On Thursday, a hydraulic system that can hold five twowheelers at a height of about 9ft, with space for five to be parked at the ground level was opened at Meenambakkam metro station on a trial basis. “We will wait to see its safety and response from commuters for a month before extending it to other stations. We will build a level between street level and concourse for parking in station,” an official said.

",chennai,"https://static.toiimg.com/thumb/msid-73077684,width-1070,height-580,imgsize-525543,resizemode-75,overlay-toi_sw,pt-32,y_pad-40/photo.jpg",http://timesofindia.indiatimes.com//city/chennai/central-metro-station-to-get-parking-space-in-two-weeks/articleshow/73077682.cms
126,['3/01/2020'],Passengers at Rajiv Gandhi International Airport set to cross 22 million in 2019-20,"Rajiv Gandhi International Airport (RGIA) has emerged as the best-connected facility in south and central Indi... Read More

HYDERABAD: With 55 non-stop domestic destinations under its wings, Rajiv Gandhi International Airport ( RGIA ) has emerged as the best-connected facility in south and central India, latest records show. It beat Bengaluru, which reportedly has about 52 connections.The city’s airport hit a new high in annual footfall during the last financial year, with the figure touching 21.36 million, as against 18.30 million recorded during the previous corresponding year. Sources say, the yearly passenger movement through RGIA might cross 22 million this year. “In fact, RGIA is currently expanding to handle 34 million passengers per annum,” stated a release issued by the GMR Hyderabad International Airport Ltd (GHIAL).Commissioned in 2008, the airport has eight domestic and 21 international carriers operating out of it. The facility operates 25 passenger airlines connecting 71domestic and international destinations.“Given the size and scale of operations of Hyderabad Airport, we see it as a gateway airport to a vast region stretching into entire northern Karnataka, south-eastern Maharashtra, Chhattisgarh, Odisha, Andhra Pradesh. We have identified over 15 cities which we are targeting through our ‘Fly via Hyderabad’ campaign. Our vision in the next five to 10 years is to become a big transit hub,” said a source.",hyderabad,"https://static.toiimg.com/thumb/msid-73077688,width-1070,height-580,imgsize-796693,resizemode-75,overlay-toi_sw,pt-32,y_pad-40/photo.jpg",http://timesofindia.indiatimes.com//city/hyderabad/passengers-at-rajiv-gandhi-international-airport-set-to-cross-22-million-in-2019-20/articleshow/73077671.cms
127,['3/01/2020'],Tamil Nadu woman dies after doctors leave cotton in her abdomen,"This story is from January 3, 2020

Representative image",puducherry,"https://static.toiimg.com/thumb/msid-73077694,width-1070,height-580,imgsize-166544,resizemode-75,overlay-toi_sw,pt-32,y_pad-40/photo.jpg",http://timesofindia.indiatimes.com//city/puducherry/tamil-nadu-woman-dies-after-doctors-leave-cotton-in-her-abdomen/articleshow/73077697.cms
128,['3/01/2020'],Telangana records 13% growth in December GST collection,"Representative image

HYDERABAD: In a good news for the state reeling under economic slowdown, GST collection data released by Union finance ministry shows that Telangana recorded 13% growth in GST collection in December 2019, as compared to December 2018.As per the data, in December 2018, GST collections were ₹3,014 crore, whereas in 2019, the collections went up to ₹3,420 crore. Though Tamil Nadu and Kerala are ahead of Telangana, officials attributed the increase to better GST compliance by traders and companies and good business growth. “Development happens due to various reasons, we feel that things will get back to normal, this is natural,” said planning board vice-chairman B Vinod Kumar.Meanwhile, the country’s GST revenue during December 2019 from domestic transactions showed an impressive growth of 16% as compared to 2018. The neighbouring state of Andhra Pradesh witnessed a 11% growth in competitive figures. In December 2018, AP’s GST collections were ₹2,049 crore and in December 2018, the collections stood at ₹2,265 crore.Experts said that this could be a good sign for the state, stating that if the GST collection grows further in the next two to three months, it would mean that the economy is recovering from the slowdown. “Last month, the government made strict measures for GST collection, in general, in December the collection improved due to festivities,” said financial expert and former IDBI director Narsimha Murthy.Experts further observed that the GST collection indicates slow growth, but added that many other factors will come into play which will help the GDP grow as both GST and GDP growth are interlinked.",hyderabad,"https://static.toiimg.com/thumb/msid-73077703,width-1070,height-580,imgsize-81311,resizemode-75,overlay-toi_sw,pt-32,y_pad-40/photo.jpg",http://timesofindia.indiatimes.com//city/hyderabad/telangana-records-13-growth-in-december-gst-collection/articleshow/73077710.cms
129,['3/01/2020'],ATF Price Hike in Chennai: ATF price hike could force airlines to avoid refuelling in Chennai,"This story is from January 3, 2020

Fuel price varies from one airport to the other because state governments charge different slabs of tax.

CHENNAI: An increase in price of aviation turbine fuel (ATF) has made Chennai the second most expensive city to buy jet fuel, which can force airlines to avoid refuelling in the city airport. This will also lead to a hike in air fares.

ATF fuel prices were increased by 2.6% on January

1. This makes the one kilo litre of ATF to cost ₹65, 619 in Chennai airport while it costs ₹70,588 in Kolkata, the highest in a metro airport. Prices are lower in Mumbai and Delhi.

The price was ₹63,830 per kilo litre in Chennai as of December 1, 2018. Now, airlines will have to pay ₹1,789 more. An A320 type plane uses around six tonnes of fuel for a short domestic flight.

This is expected to encourage airlines to lift fuel from other airports and not from Chennai. The process called tankering or carrying more fuel than needed for a trip will go up, said a pilot.

""If an aircraft needs only six tonnes of fuel, the pilot will try to carry 12tonnes depending on the passenger and cargo load so that the next sector can also be flown without refueling in Chennai,"" he added.

This practice is expected to increase in the coming days as most of the domestic carriers fly multiple routes using the same plane. Since, Mumbai and Delhi is the hub for airlines to park their planes as the airports have more parking bays than in Chennai, there is a chance that pilots will carry fuel from Mumbai.

""This is likely to impact the load of the plane and quantity of cargo may have to be reduced to carry fuel. However, flights flying from Chennai to Delhi may have to carry extra fuel than they usually carry because air congestion caused by fog is leading to delays and diversions. This will be a loss,"" said an airline official.

The fuel price varies from one airport to the other because state governments charge a tax. The tax is higher in Tamil Nadu. There was a call to make prices or taxes uniform across all airports.

An official of the Airports Authority of India (AAI) said that ""The state government has reduced the tax for fuel at small airports like Coimbatore. But, in Chennai they charge high because refueling is high and there is scope for earning more money.""

Air Passengers Association of Indi national president D Sudhakara Reddy said ""Air fares are bound to go up. Already airlines are incurring loss because of the mess caused by air congestion in Delhi. The congestion is having a cascading effect of delays at all airports. This will add to it. Its surprising that they are increasing the jet fuel price though price of crude has reduced from $68 per barrel to $66.""

",chennai,"https://static.toiimg.com/thumb/msid-73077711,width-1070,height-580,imgsize-606391,resizemode-75,overlay-toi_sw,pt-32,y_pad-40/photo.jpg",http://timesofindia.indiatimes.com//city/chennai/atf-price-hike-could-force-airlines-to-avoid-refuelling-in-chennai/articleshow/73077713.cms
130,['3/01/2020'],Man dies of electric shock in Selaiyur,"This story is from January 3, 2020

Representative image

CHENNAI: A 25-year-old man who latched on to an electric pole for support while crossing a water-logged stretch in Selaiyur on Thursday was electrocuted.

Police said Senthil Kumar, a resident of the Tambaram Railway Quarters, was an employee on an online shopping firm. The incident happened at 1.30am on Velachery Main Road, just a few metres from the Selaiyur police station.

An electrician who was involved in removing a series of decorative lights set up at the Selaiyur police station for the New Year celebrations saw Senthil Kumar jumping over the stagnant patch of water. Senthil lost control and held an electric pole when he was thrown away.

The electrician immediately rushed to the spot and alerted police.

Senthil died on the spot. His body was sent to the Chromepet Government hospital for postmortem. Police said power leakage from the electric pole may have caused the death.

",chennai,"https://static.toiimg.com/thumb/msid-73077740,width-1070,height-580,imgsize-365748,resizemode-75,overlay-toi_sw,pt-32,y_pad-40/photo.jpg",http://timesofindia.indiatimes.com//city/chennai/man-dies-of-electric-shock-in-selaiyur/articleshow/73077742.cms
131,['3/01/2020'],Second Akali ex-sarpanch shot dead in over a month,"This story is from January 3, 2020

Representative image",amritsar,"https://static.toiimg.com/thumb/msid-73077814,width-1070,height-580,imgsize-93360,resizemode-75,overlay-toi_sw,pt-32,y_pad-40/photo.jpg",http://timesofindia.indiatimes.com//city/amritsar/second-akali-ex-sarpanch-shot-dead-in-over-a-month/articleshow/73077781.cms
132,['3/01/2020'],"UP: Anti-CAA protester released from jail, reunited with baby after 14 days","This story is from January 3, 2020

Activist Ekta Shekher with Champak after getting bail.",varanasi,"https://static.toiimg.com/thumb/msid-73077795,width-1070,height-580,imgsize-792716,resizemode-75,overlay-toi_sw,pt-32,y_pad-40/photo.jpg",http://timesofindia.indiatimes.com//city/varanasi/uttar-pradesh-baby-reunites-with-mom-after-14-days/articleshow/73077791.cms
